doi,标题,期刊,年份,作者
,Subwavelength control of light transport at the exceptional point by non-Hermitian metagratings,Science Advances,2023,"Yihao Xu,Lin Li,Heonyeong Jeong,Seokwoo Kim,Inki Kim,Junsuk Rho,Yongmin Liu"
,Software-defined nanophotonic devices and systems empowered by machine learning,Progress in Quantum Electronics,2023,"Yihao Xu,Bo Xiong,Wei Ma,Yongmin Liu"
,Ultrafast all-optical manipulation of magnetization in ferromagnetic thin films,"International Workshop on Thin Films for Electronics, Electro-Optics, Energy and Sensors 2022",2023,Yongmin Liu
10.1126/science.ade5140,Breaking the limitation of polarization multiplexing in optical metasurfaces with engineered noise.,"Science (New York, N.Y.)",2023,"Bo Xiong,Yu Liu,Yihao Xu,Lin Deng,Chao-Wei Chen,Jia-Nan Wang,Ruwen Peng,Yun Lai,Yongmin Liu,Mu Wang"
,Editorial of special issue on optical metasurfaces:fundamentals and applications,Chinese Optics Letters,2023,"Tao Li,Cheng Zhang,Yongmin Liu"
10.1109/TAP.2022.3161487,Reconfigurable Vector Vortex Beams Using Spoof Surface Plasmon Ring Resonators,IEEE Transactions on Antennas and Propagation,2022,"Zhen Liao,Yanziyi Che,Leilei Liu,Bai Cao Pan,Ben Geng Cai,Jia Nan Zhou,Guo Qing Luo,Yongmin Liu"
10.1002/adma.202108479,Rapid Identification of DNA Fragments through Direct Sequencing with Electro-Optical Zero-Mode Waveguides,ADVANCED MATERIALS,2022,"Fatemeh Farhangdoust,Feng Cheng,Wentao Liang,Yongmin Liu,Meni Wanunu"
10.1021/acsphotonics.2c01397,"Decoupled phase modulation for circularly polarized lights via chiral
  metasurface",,2022,"Renchao Jin,Lin Deng,Lili Tang,Yue Cao,Yongmin Liu,Zheng-Gao Dong"
10.1016/j.bioactmat.2021.08.015,3D direct printing of mechanical and biocompatible hydrogel meta-structures,BIOACTIVE MATERIALS,2022,"Lei Zhang,Wenhan Lee,Xinhao Li,Yanhui Jiang,Nicholas Xuanlai Fang,Guohao Dai,Yongmin Liu"
10.1002/adom.202200910,On‐Demand Mode Conversion and Wavefront Shaping via On‐Chip Metasurfaces,Advanced Optical Materials,2022,"Lin Deng,Yihao Xu,Renchao Jin,Ziqiang Cai,Yongmin Liu"
10.1016/j.photonics.2022.101073,Hybrid inverse design of photonic structures by combining optimization methods with neural networks,Photonics and Nanostructures - Fundamentals and Applications,2022,"Lin Deng,Yihao Xu,Yongmin Liu"
10.1002/adma.202110022,Pushing the Limits of Functionality-Multiplexing Capability in Metasurface Design Based on Statistical Machine Learning,ADVANCED MATERIALS,2022,"Wei Ma,Yihao Xu,Bo Xiong,Lin Deng,Ru-Wen Peng,Mu Wang,Yongmin Liu"
10.1103/PhysRevB.106.174401,Electric field tuning of ultrafast demagnetization in a magnetoelectric heterostructure,PHYSICAL REVIEW B,2022,"A. R. Will-Cole,Chuangtang Wang,Nirjhar Bhattacharjee,Yongmin Liu,N. X. Sun"
10.1002/adom.202102135,Near‐Infrared Reflection Modulation Through Electrical Tuning of Hybrid Graphene Metasurfaces,Advanced Optical Materials,2022,"Ziqiang Cai,Yongmin Liu"
10.1021/acs.nanolett.1c03772,Optical Pulling Forces Enabled by Hyperbolic Metamaterials,NANO LETTERS,2021,"Renchao Jin,Yihao Xu,Zheng-Gao Dong,Yongmin Liu"
10.1002/lpor.202000426,Polarization Shaping Of Free-Electron Radiation By Gradient Bianisotropic Metasurfaces,LASER & PHOTONICS REVIEWS,2021,"Liqiao Jing,Xiao Lin,Zuojia Wang,Ido Kaminer,Hao Hu,Erping Li,Yongmin Liu,Min Chen,Baile Zhang,Hongsheng Chen"
10.1002/adma.202005864,Realizing Colorful Holographic Mimicry By Metasurfaces,ADVANCED MATERIALS,2021,"Bo Xiong,Yihao Xu,Jianan Wang,Lin Li,Lin Deng,Feng Cheng,Ru-Wen Peng,Mu Wang,Yongmin Liu"
10.1364/PRJ.417693,Interfacing Photonics With Artificial Intelligence: An Innovative Design Strategy For Photonic Structures And Devices Based On Artificial Neural Networks,PHOTONICS RESEARCH,2021,"Yihao Xu,Xianzhe Zhang,Yun Fu,Yongmin Liu"
10.1038/s41566-020-0685-y,Deep Learning For The Design Of Photonic Structures,NATURE PHOTONICS,2021,"Wei Ma,Zhaocheng Liu,Zhaxylyk A. Kudyshev,Alexandra Boltasseva,Wenshan Cai,Yongmin Liu"
10.1002/lpor.202100155,Electrically Driven Tunable Broadband Polarization States Via Active Metasurfaces Based On Joule-Heat-Induced Phase Transition Of Vanadium Dioxide,LASER & PHOTONICS REVIEWS,2021,"Fang-Zhou Shu,Jia-Nan Wang,Ru-Wen Peng,Bo Xiong,Ren-Hao Fan,Ya-Jun Gao,Yongmin Liu,Dong-Xiang Qi,Mu Wang"
10.1021/acsami.1c02724,Self-Assembly Of Silica-Gold Core-Shell Microparticles By Electric Fields Toward Dynamically Tunable Metamaterials,ACS APPLIED MATERIALS & INTERFACES,2021,"Han Gao,Yihao Xu,Kan Yao,Yongmin Liu"
10.1063/5.0053834,Demonstration Of Microwave Plasmonic-Like Vortices With Tunable Topological Charges By A Single Metaparticle,APPLIED PHYSICS LETTERS,2021,"Guangxu Su,Hai Su,Lumang Hu,Zhaofu Qin,Xiaopeng Shen,Jianping Ding,Fanxin Liu,Minghui Lu,Peng Zhan,Yongmin Liu"
,Rapid Identification of DNA Fragments through Direct Sequencing with Electro-Optical Waveguides,,2021,"Fatemeh  Farhangdoust,Feng  Cheng,Wentao  Liang,Yongmin  Liu,Meni  Wanunu"
10.1364/OME.442854,Artificial Intelligence Meets Engineered Photonic Materials: Introduction To Special Issue,OPTICAL MATERIALS EXPRESS,2021,"Wenshan Cai,Yongmin Liu,Junsuk Rho,Haim Suchowski,Peter Wiecha"
10.1109/RAPID49481.2020.9195680,Accelerating the Design of Photonic Metamaterials by Artificial Intelligence,2020 IEEE Research and Applications of Photonics in Defense Conference (RAPID),2020,Yongmin Liu
10.1103/PhysRevApplied.13.044037,Nonreciprocal Isolation and Wavelength Conversion via a Spatiotemporally Engineered Cascaded Cavity,PHYSICAL REVIEW APPLIED,2020,"Xingping Zhou,Samit Kumar Gupta,Xueyi Zhu,Guangxu Su,Peng Zhan,Yongmin Liu,Zhuo Chen,Minghui Lu,Zhenlin Wang"
10.1002/adom.202000379,All-Optical Helicity-Dependent Switching in Hybrid Metal-Ferromagnet Thin Films,ADVANCED OPTICAL MATERIALS,2020,"Feng Cheng,Zhidong Du,Xinjun Wang,Ziqiang Cai,Lin Li,Chuangtang Wang,Abdelkrim Benabbas,Paul Champion,Nianxiang Sun,Liang Pan,Yongmin Liu"
10.1002/adom.201901090,Polariton Photonics Using Structured Metals and 2D Materials,ADVANCED OPTICAL MATERIALS,2020,"Ziqiang Cai,Yihao Xu,Chuangtang Wang,Yongmin Liu"
10.1007/s11433-020-1575-2,A data-efficient self-supervised deep learning model for design and characterization of nanophotonic structures,SCIENCE CHINA-PHYSICS MECHANICS & ASTRONOMY,2020,"Wei Ma,Yongmin Liu"
10.1021/acsphotonics.9b01608,Experimental Demonstration of Multidimensional and Multifunctional Metalenses Based on Photonic Spin Hall Effect,ACS Photonics,2020,"Renchao Jin,Lili Tang,Jiaqi Li,Jin Wang,Qian-Jin Wang,Yongmin Liu,Zheng-Gao Dong"
10.1002/lpor.201900244,Harnessing Evanescent Waves By Bianisotropic Metasurfaces,LASER & PHOTONICS REVIEWS,2020,"Lin Li,Kan Yao,Zuojia Wang,Yongmin Liu"
10.1186/s40580-020-00246-3,Ultrafast optical manipulation of magnetic order in ferromagnetic materials.,NANO CONVERGENCE,2020,"Chuangtang Wang,Yongmin Liu"
10.1103/PhysRevApplied.13.054013,Microwave-Vortex-Beam Generation Based on Spoof-Plasmon Ring Resonators,PHYSICAL REVIEW APPLIED,2020,"Zhen Liao,Jia Nan Zhou,Guo Qing Luo,Meng Wang,Shi Sun,Tao Zhou,Hui Feng Ma,Tie Jun Cui,Yongmin Liu"
10.1021/acs.nanolett.0c02089,All-Optical Manipulation of Magnetization in Ferromagnetic Thin Films Enhanced by Plasmonic Resonances.,NANO LETTERS,2020,"Feng Cheng,Chuangtang Wang,Zhaoxian Su,Xinjun Wang,Ziqiang Cai,Nian X Sun,Yongmin Liu"
10.1364/OL.44.000319,Dual-mode subwavelength trapping by plasmonic tweezers based on V-type nanoantennas.,OPTICS LETTERS,2019,"Ren-Chao Jin,Jia-Qi Li,Lin Li,Zheng-Gao Dong,Yongmin Liu"
10.1002/adma.201901111,Probabilistic Representation and Inverse Design of Metamaterials Based on a Deep Generative Model with Semi-Supervised Learning Strategy.,ADVANCED MATERIALS,2019,"Wei Ma,Feng Cheng,Yihao Xu,Qinlong Wen,Yongmin Liu"
10.1039/c9na00343f,Controlling The Degrees Of Freedom In Metasurface Designs For Multi-Functional Optical Devices,NANOSCALE ADVANCES,2019,"Bo Xiong,Lin Deng,Ruwen Peng,Yongmin Liu"
10.1002/adom.201970032,Plasmonic Composite Films: Plasmonic‐Enhanced Cholesteric Films: Coassembling Anisotropic Gold Nanorods with Cellulose Nanocrystals (Advanced Optical Materials 9/2019),Advanced Optical Materials,2019,"Zheng Cheng,Yi Ma,Lin Yang,Feng Cheng,Zhongjie Huang,Avi Natan,Hongyan Li,Yong Chen,Daxian Cao,Zhifeng Huang,YuHuang Wang,Yongmin Liu,Rendang Yang,Hongli Zhu"
10.1021/acs.jpcc.9b03635,Edge Doping Effect to the Surface Plasmon Resonances in Graphene Nanoribbons,JOURNAL OF PHYSICAL CHEMISTRY C,2019,"Don C. Abeysinghe,Nima Nader,Joshua Myers,Joshua R. Hendrickson,Justin W. Cleary,Dennis E. Walker,Kuei-Hsien Chen,Yongmin Liu,Shin Mou"
10.1021/acsphotonics.9b00251,Complete Control of Smith-Purcell Radiation by Graphene Metasurfaces,ACS Photonics,2019,"Zhaoxian Su,Feng Cheng,Lin Li,Yongmin Liu"
10.1103/PhysRevB.100.035444,"Polarization-Dependent Near-Field Phonon Nanoscopy Of Oxides: Srtio3, Linbo3, And Pbzr0.2ti0.8o3",PHYSICAL REVIEW B,2019,"Lukas Wehmeier,Denny Lang,Yongmin Liu,Xiang Zhang,Stephan Winnerl,Lukas M. Eng,Susanne C. Kehr"
,Harnessing Evanescent Waves by Metasurfaces: An All-Optical Analogue of On-Chip Control of Smith-Purcell Emission,Bulletin of the American Physical Society,2019,"Lin Li,Kan Yao,Zuojia Wang,Yongmin Liu"
10.1103/PhysRevApplied.12.044009,Photonic Heterostructures for Spin-Flipped Beam Splitting,PHYSICAL REVIEW APPLIED,2019,"Chuanning Niu,Zuojia Wang,Jia Zhao,Liuge Du,Na Liu,Yongmin Liu,Xun Li"
10.1103/physics.12.14,A Metamaterial for Superscattering Light,Physics,2019,Yongmin Liu
10.1002/adom.201801816,Plasmonic-Enhanced Cholesteric Films: Coassembling Anisotropic Gold Nanorods with Cellulose Nanocrystals,ADVANCED OPTICAL MATERIALS,2019,"Zheng Cheng,Yi Ma,Lin Yang,Feng Cheng,Zhongjie Huang,Avi Natan,Hongyan Li,Yong Chen,Daxian Cao,Zhifeng Huang,YuHuang Wang,Yongmin Liu,Rendang Yang,Hongli Zhu"
10.1002/admi.201802010,Tuning Chiral Nematic Pitch of Bioresourced Photonic Films via Coupling Organic Acid Hydrolysis,ADVANCED MATERIALS INTERFACES,2019,"Zheng Cheng,Huilin Ye,Feng Cheng,Hongyan Li,Yi Ma,Qing Zhang,Avi Natan,Alolika Mukhopadhyay,Yucong Jiao,Ying Li,Yongmin Liu,Hongli Zhu"
10.1002/adom.201801666,Manipulating Cherenkov Radiation and Smith–Purcell Radiation by Artificial Structures,ADVANCED OPTICAL MATERIALS,2019,"Zhaoxian Su,Bo Xiong,Yihao Xu,Ziqiang Cai,Jianbo Yin,Ruwen Peng,Yongmin Liu"
10.1002/lpor.201800010,Efficient Generation of Microwave Plasmonic Vortices via a Single Deep‐Subwavelength Meta‐Particle,LASER & PHOTONICS REVIEWS,2018,"Hai Su,Xiaopeng Shen,Guangxu Su,Lin Li,Jianping Ding,Fanxin Liu,Peng Zhan,Yongmin Liu,Zhenlin Wang"
10.1002/lpor.201870041,Plasmonic Vortices: Efficient Generation of Microwave Plasmonic Vortices via a Single Deep-Subwavelength Meta-Particle (Laser Photonics Rev. 12(9)/2018),Laser & Photonics Reviews,2018,"Hai Su,Xiaopeng Shen,Guangxu Su,Lin Li,Jianping Ding,Fanxin Liu,Peng Zhan,Yongmin Liu,Zhenlin Wang"
10.1021/acsphotonics.7b01012,Infrared Plasmonic Resonators Based on Self-Assembled Core–Shell Particles,ACS Photonics,2018,"Kan Yao,Yongmin Liu"
10.1103/PhysRevLett.120.123901,Self-Induced Backaction Optical Pulling Force.,PHYSICAL REVIEW LETTERS,2018,"Tongtong Zhu,Yongyin Cao,Lin Wang,Zhongquan Nie,Tun Cao,Fangkui Sun,Zehui Jiang,Manuel Nieto-Vesperinas,Yongmin Liu,Cheng-Wei Qiu,Weiqiang Ding"
10.1103/PhysRevApplied.9.034009,Dynamically Switching the Polarization State of Light Based on the Phase Transition of Vanadium Dioxide,PHYSICAL REVIEW APPLIED,2018,"Zhi-Yong Jia,Fang‐Zhou Shu,Yajun Gao,Feng Cheng,Ru-Wen Peng,Ren-Hao Fan,Yongmin Liu,Mu Wang"
10.1109/apusncursinrsm.2018.8609120,A Chiral Meta-Mirror Enabled Linear And Nonlinear Chiroptical Responses,2018 IEEE ANTENNAS AND PROPAGATION SOCIETY INTERNATIONAL SYMPOSIUM ON ANTENNAS AND PROPAGATION & USNC/URSI NATIONAL RADIO SCIENCE MEETING,2018,"Lei Kang,Sean P. Rodrigues,Mohammad Taghinejad,Shoufeng Lan,Kyu-Tae Lee,Taiwei Yue,Sawyer D. Campbell,Yongmin Liu,Augustine Urbas,Wenshan Cai,Douglas H. Werner"
10.1364/OL.43.002636,Graphene-metal hybrid metamaterials for strong and tunable circular dichroism generation.,OPTICS LETTERS,2018,"Zhong Huang,Kan Yao,Guangxu Su,Wei Ma,Lin Li,Yongmin Liu,Peng Zhan,Zhenlin Wang"
10.1002/adom.201700939,Dynamic Plasmonic Color Generation Based on Phase Transition of Vanadium Dioxide,ADVANCED OPTICAL MATERIALS,2018,"Fang‐Zhou Shu,Fangfang Yu,Ru-Wen Peng,Yingying Zhu,Bo Xiong,Ren-Hao Fan,Zheng-Han Wang,Yongmin Liu,Mu Wang"
10.1021/acsnano.8b03569,Deep-Learning Enabled On-Demand Design of Chiral Metamaterials.,ACS nano,2018,"Wei Ma,Feng Cheng,Yongmin Liu"
10.1039/c8nr00902c,Enhancing circular dichroism by chiral hotspots in silicon nanocube dimers.,NANOSCALE,2018,"Kan Yao,Yongmin Liu"
10.1038/s41598-017-15514-2,Controlling The Bidirectional Circular Polarization States Using Ultrathin Back-To-Back Quarter-Wave Plates Cavity,SCIENTIFIC REPORTS,2017,"Le Chang,Yue Li,Yongmin Liu"
10.1021/acs.nanolett.7b03882,Preserving Spin States upon Reflection: Linear and Nonlinear Responses of a Chiral Meta-Mirror.,NANO LETTERS,2017,"Lei Kang,Sean P Rodrigues,Mohammad Taghinejad,Shoufeng Lan,Kyu-Tae Lee,Yongmin Liu,Douglas H Werner,Augustine Urbas,Wenshan Cai"
10.1038/s41598-017-13568-w,Prediction Of Deterministic All-Optical Switching Of Ferromagnetic Thin Film By Ultrafast Optothermal And Optomagnetic Couplings,SCIENTIFIC REPORTS,2017,"Zhidong Du,Chen Chen,Feng Cheng,Yongmin Liu,Liang Pan"
10.1021/acsnano.7b01428,All-Optical Chirality-Sensitive Sorting via Reversible Lateral Forces in Interference Fields,ACS Nano,2017,"Tianhang Zhang,Mahdy Rahman Chowdhury Mahdy,Yongmin Liu,Jinghua Teng,Chwee Teck Lim,Zheng Wang,Cheng-Wei Qiu"
10.1117/12.2257236,Deep-subwavelength near-field imaging based on perovskites and doped semiconductors at infrared frequencies,Proceedings of SPIE,2017,Yongmin Liu
10.1021/acsphotonics.7b00351,Dual-Band Light Focusing Using Stacked Graphene Metasurfaces,ACS Photonics,2017,"Wei Ma,Zhong Huang,Xiaokang Bai,Peng Zhan,Yongmin Liu"
10.1364/fio.2017.jw3a.100,Unidirectional Excitation of Radiative-Loss-Free Surface Plasmon Polaritons in Parity-Time Symmetric Systems,Frontiers in Optics,2017,"Wei Wang,Lu-Qi Wang,Rui-Dong Xue,Hao-Ling Chen,Rui-Peng Guo,Zhong Huang,Yongmin Liu,Jing Chen"
10.1063/1.4985132,Chiral Metamirrors For Broadband Spin-Selective Absorption,APPLIED PHYSICS LETTERS,2017,"Liqiao Jing,Zuojia Wang,Yihao Yang,Bin Zheng,Yongmin Liu,Hongsheng Chen"
10.1002/adom.201700600,A Broadband Optical Diode for Linearly Polarized Light Using Symmetry-Breaking Metamaterials,ADVANCED OPTICAL MATERIALS,2017,"Minkyung Kim,Kan Yao,Gwanho Yoon,Inki Kim,Yongmin Liu,Junsuk Rho"
10.1364/fio.2017.fm3d.2,Dual-band focusing metasurfaces based on stacked graphene ribbons,Frontiers in Optics,2017,"Wei Ma,Zhong Huang,Xiaokang Bai,Peng Zhan,Yongmin Liu"
10.1103/PhysRevLett.119.077401,Unidirectional Excitation of Radiative-Loss-Free Surface Plasmon Polaritons in PT-Symmetric Systems.,PHYSICAL REVIEW LETTERS,2017,"Wei Wang,Lu-Qi Wang,Rui-Dong Xue,Hao-Ling Chen,Rui-Peng Guo,Yongmin Liu,Jing Chen"
10.1002/adma.201700412,Origami-Based Reconfigurable Metamaterials for Tunable Chirality.,ADVANCED MATERIALS,2017,"Zuojia Wang,Liqiao Jing,Kan Yao,Yihao Yang,Bin Zheng,Costas M Soukoulis,Hongsheng Chen,Yongmin Liu"
https://doi.org/10.1007/s11468-016-0438-4,Inverse Design of Dielectric Resonator Cloaking Based on Topology Optimization,Plasmonics,2017,"Yongbo Deng,Zhenyu Liu,Yongmin Liu,Yihui Wu"
10.1073/pnas.1703000114,Ultrafast Fluorescent Decay Induced By Metal-Mediated Dipole-Dipole Interaction In Two-Dimensional Molecular Aggregates,PROCEEDINGS OF THE NATIONAL ACADEMY OF SCIENCES OF THE UNITED STATES OF AMERICA,2017,"Qing Hu,Dafei Jin,Jun Xiao,Sang Hoon Nam,Xiaoze Liu,Yongmin Liu,Xiang Zhang,Nicholas X. Fang"
10.1109/PIERS.2016.7734432,Dynamically Switchable Metasurfaces Based On Graphene And Origami,2016 PROGRESS IN ELECTROMAGNETICS RESEARCH SYMPOSIUM (PIERS),2016,"Yongmin Liu,Zuojia Wang,Liqiao Jing,Hongsheng Chen"
10.1364/fio.2016.jth2a.176,Self-Assembled Plasmonic Core-Shell Clusters for Infrared Resonators,Frontiers in Optics,2016,"Kan Yao,Yongmin Liu"
10.1088/0957-4484/27/41/412001,"Optical chiral metamaterials: a review of the fundamentals, fabrication methods and applications.",NANOTECHNOLOGY,2016,"Zuojia Wang,Feng Cheng,Thomas Winsor,Yongmin Liu"
10.1007/s00158-015-1388-8,Topology optimization of metal nanostructures for localized surface plasmon resonances,Structural and Multidisciplinary Optimization,2016,"Yongbo Deng,Zhenyu Liu,Chao Song,Peng Hao,Yihui Wu,Yongmin Liu,Jan G Korvink"
10.1103/PhysRevLett.117.157401,Manipulating Smith-Purcell Emission with Babinet Metasurfaces.,PHYSICAL REVIEW LETTERS,2016,"Zuojia Wang,Kan Yao,Min Chen,Hongsheng Chen,Yongmin Liu"
10.1201/9781315364742-3,Chapter 2 Conformal Mapping in Transformation Optics,Transformation Wave Physics,2016,"Kan Yao,Yongmin Liu,Kan Yao,Yongmin Liu"
10.1021/acsphotonics.6b00533,Circular dichroism metamirrors with near-perfect extinction,progress in electromagnetic research symposium,2016,"Zuojia Wang,Hui Jia,Kan Yao,Wenshan Cai,Hongsheng Chen,Yongmin Liu"
10.1038/srep38645,Deep Sub-Wavelength Nanofocusing Of Uv-Visible Light By Hyperbolic Metamaterials,SCIENTIFIC REPORTS,2016,"Minkyung Kim,Sunae So,Kan Yao,Yongmin Liu,Junsuk Rho"
10.1126/sciadv.1501142,Asymmetric excitation of surface plasmons by dark mode coupling,Science Advances,2016,"Xueqian Zhang,Quan Xu,Quan Li,Yuehong Xu,Jianqiang Gu,Zhen Tian,Chunmei Ouyang,Yongmin Liu,Shuang Zhang,Xixiang Zhang,Jiaguang Han,Weili Zhang"
10.1038/s41598-016-0027-y,Near-Field Surface Plasmons On Quasicrystal Metasurfaces,SCIENTIFIC REPORTS,2016,"Quanlong Yang,Xueqian Zhang,Shaoxian Li,Quan Xu,Ranjan Singh,Yongmin Liu,Yanfeng Li,Sergey S Kruk,Jianqiang Gu,Jiaguang Han,Weili Zhang"
10.1364/CLEO_QELS.2016.FW4A.6,A Chiral Metamaterial For Chiral Responsive Optoelectronic Transduction,2016 CONFERENCE ON LASERS AND ELECTRO-OPTICS (CLEO),2016,"Sean P. Rodrigues,Lei Kang,Shoufeng Lan,Yonghao Cui,Yongmin Liu,Douglas H. Werner,Wenshan Cai"
10.1021/acsphotonics.5b00697,Controlling Electric and Magnetic Resonances for Ultracompact Nanoantennas with Tunable Directionality,ACS Photonics,2016,"Kan Yao,Yongmin Liu"
10.1021/nl503996q,Plasmonic superlensing in doped GaAs.,NANO LETTERS,2015,"Markus Fehrenbacher,Stephan Winnerl,Harald Schneider,Jonathan Döring,Susanne C Kehr,Lukas M Eng,Yongheng Huo,Oliver G Schmidt,Kan Yao,Yongmin Liu,Manfred Helm"
,Phase Control By Graphene Metasurface,2015 CONFERENCE ON LASERS AND ELECTRO-OPTICS (CLEO),2015,"zubin li,kan yao,yongmin liu,jianguo tian"
,Perfect Circular Dichroic Metamirrors,,2015,"zuojia wang,hongsheng chen,yongmin liu"
10.1002/adma.201501930,An Active Metamaterial Platform for Chiral Responsive Optoelectronics,ADVANCED MATERIALS,2015,"lei kang,shoufeng lan,yonghao cui,sean p rodrigues,yongmin liu,douglas h werner,wenshan cai"
10.1038/lsa.2015.101,Chiral surface waves supported by biaxial hyperbolic metamaterials,LIGHT-SCIENCE & APPLICATIONS,2015,"Wenlong Gao,Fengzhou Fang,Yongmin Liu,Shuang Zhang"
10.1364/NOMA.2015.NS1A.1,Plasmonic Metasurfaces to Steer Near-Field and Far-Field Optical Waves,Advanced Photonics 2015,2015,yongmin liu
10.1364/LS.2015.LTh3I.4,Controlling Electric and Magnetic Resonances for Ultra-Compact Nanoantennas with Switchable Directionality,Frontiers in Optics,2015,"Kan Yao,Yongmin Liu"
,Plasmonic metamaterials,Nanotechnology Reviews,2014,"Yao Kan,Liu Yongmin"
10.1039/c4nr01407c,Single-molecule detection and radiation control in solutions at high concentrations via a heterogeneous optical slot antenna.,NANOSCALE,2014,"Chenglong Zhao,Yongmin Liu,Jing Yang,Jiasen Zhang"
10.1364/OE.22.002725,Modeling and optimization of photonic crystal devices based on transformation optics method.,OPTICS EXPRESS,2014,"Yinghui Cao,Jun Xie,Yongmin Liu,Zhenyu Liu"
10.1051/epjam/2014006,Light Manipulation With Encoded Plasmonic Nanostructures,EPJ APPLIED METAMATERIALS,2014,"chenglong zhao,jiasen zhang,yongmin liu"
10.1088/1367-2630/16/6/063008,An analogy strategy for transformation optics,NEW JOURNAL OF PHYSICS,2014,"kan yao,huanyang chen,yongmin liu,xunya jiang"
10.1103/PhysRevB.90.195411,Thermal Plasmonic Interconnects In Graphene,PHYSICAL REVIEW B,2014,"baoan liu,yongmin liu,sheng shen"
10.1021/am5032727,Synthesis of magnetically separable Ag3PO4/TiO2/Fe3O4 heterostructure with enhanced photocatalytic performance under visible light for photoinactivation of bacteria.,ACS applied materials & interfaces,2014,"Jing-Wen Xu,Zhi-Da Gao,Kun Han,Yongmin Liu,Yan-Yan Song"
10.1063/1.4821444,Metasurfaces For Manipulating Surface Plasmons,APPLIED PHYSICS LETTERS,2013,"yongmin liu,xiang zhang"
10.1021/nl403047m,Giant suppression of photobleaching for single molecule detection via the Purcell effect.,NANO LETTERS,2013,"Hu Cang,Yongmin Liu,Yuan Wang,Xiaobo Yin,Xiang Zhang"
10.1143/JPSJ.72.346,Absence of Suppression in the Persistent Current by Delocalization in Random-dimer Mesoscopic Rings,JOURNAL OF THE PHYSICAL SOCIETY OF JAPAN,2013,"Y. M. Liu,R. W. Peng,X. Q. Huang,Mu Wang,A. Hu,S. S. Jiang"
10.1038/ncomms3305,A reconfigurable plasmofluidic lens.,NATURE COMMUNICATIONS,2013,"Chenglong Zhao,Yongmin Liu,Yanhui Zhao,Nicholas Fang,Tony Jun Huang"
10.1515/ntrev-2012-0071,Plasmonic Metamaterials,,2013,"Kan Yao,Yongmin Liu"
10.1021/nl302339z,Compact magnetic antennas for directional excitation of surface plasmons.,NANO LETTERS,2012,"Yongmin Liu,Stefano Palomba,Yongshik Park,Thomas Zentgraf,Xiaobo Yin,Xiang Zhang"
10.1039/c2nr31140b,Recent advances in transformation optics.,NANOSCALE,2012,"Yongmin Liu,Xiang Zhang"
10.1002/adma.201104483,Transparent metals for ultrabroadband electromagnetic waves.,ADVANCED MATERIALS,2012,"Ren-Hao Fan,Ru-Wen Peng,Xian-Rong Huang,Jia Li,Yongmin Liu,Qing Hu,Mu Wang,Xiang Zhang"
,Microspectroscopy on perovskite-based superlenses,,2011,"Susanne C. Kehr,Pu Yu,Yongmin Liu,Markus Parzefall,Asif Irshad Khan,Rainer Jacob,Marc Tobias Wenzel,Hans-Georg von Ribbeck,Manfred Burkhard Helm,Xiang Zhang,Lukas M. Eng,Ramamoorthy Ramesh"
,Experimental demonstration of gradient index plasmonics,,2011,"m h mikkelsen,thomas zentgraf,yongmin liu,jason valentine,xiang zhang"
10.1038/ncomms1249,Near-field examination of perovskite-based superlenses and superlens-enhanced probe-object coupling.,NATURE COMMUNICATIONS,2011,"S.C. Kehr,Y.M. Liu,L.W. Martin,X. Zhang,R. Ramesh,Y.M. Liu,P. Yu,M. Gajek,S.-Y. Yang,C.-H. Yang,M.T. Wenzel,H.-G. von Ribbeck,L.M. Eng,R. Jacob,M. Helm"
10.1038/nature09698,Probing the electromagnetic field of a 15-nanometre hotspot by single molecule imaging.,NATURE,2011,"Hu Cang,Anna Labno,Changgui Lu,Xiaobo Yin,Ming Liu,Christopher Gladden,Yongmin Liu,Xiang Zhang"
10.1039/c0cs00184h,Metamaterials: a new frontier of science and technology.,CHEMICAL SOCIETY REVIEWS,2011,"Yongmin Liu,Xiang Zhang"
10.1364/OL.36.003191,Plasmonic Airy beams with dynamically controlled trajectories.,OPTICS LETTERS,2011,"Peng Zhang,Sheng Wang,Yongmin Liu,Xiaobo Yin,Changgui Lu,Zhigang Chen,Xiang Zhang"
10.1021/nl103070n,Optical forces in hybrid plasmonic waveguides.,NANO LETTERS,2011,"Xiaodong Yang,Yongmin Liu,Rupert F Oulton,Xiaobo Yin,Xiang Zhang"
10.1021/nl201189z,A carpet cloak for visible light.,NANO LETTERS,2011,"Majid Gharghi,Christopher Gladden,Thomas Zentgraf,Yongmin Liu,Xiaobo Yin,Jason Valentine,Xiang Zhang"
10.1038/NNANO.2010.282,Plasmonic Luneburg and Eaton lenses.,NATURE NANOTECHNOLOGY,2011,"Thomas Zentgraf,Yongmin Liu,Maiken H Mikkelsen,Jason Valentine,Xiang Zhang"
10.1364/OE.18.025029,Fluorescence enhancement by a two-dimensional dielectric annular Bragg resonant cavity.,OPTICS EXPRESS,2010,"Yongmin Liu,Sheng Wang,Yong-Shik Park,Xiaobo Yin,Xiang Zhang"
10.1038/NNANO.2010.128,Light-driven nanoscale plasmonic motors.,NATURE NANOTECHNOLOGY,2010,"Ming Liu,Thomas Zentgraf,Yongmin Liu,Guy Bartal,Xiang Zhang"
10.1103/PhysRevLett.104.034501,Optical Negative Refraction In Ferrofluids With Magnetocontrollability,PHYSICAL REVIEW LETTERS,2010,"Y Gao,J P Huang,Y M Liu,L Gao,K W Yu,X Zhang"
10.1021/nl1008019,Transformational plasmon optics.,NANO LETTERS,2010,"Yongmin Liu,Thomas Zentgraf,Guy Bartal,Xiang Zhang"
10.1364/OE.18.006048,Far-field measurement of ultra-small plasmonic mode volume.,OPTICS EXPRESS,2010,"Shuang Zhang,Yong-Shik Park,Yongmin Liu,Thomas Zentgraf,Xiang Zhang"
10.1364/OE.16.015439,All-angle negative refraction and imaging in a bulk medium made of metallic nanowires in the visible region.,OPTICS EXPRESS,2008,"Yongmin Liu,Guy Bartal,Xiang Zhang"
10.1364/fio.2008.fthc1,Subwavelength Discrete Solitons in Nonlinear Metallic Waveguide Arrays,Frontiers in Optics,2008,"xiang zhang,guy bartal,yongmin liu,dentcho a genov"
10.1126/science.1157566,Optical Negative Refraction In Bulk Metamaterials Of Nanowires,SCIENCE,2008,"Jie Yao,Zhaowei Liu,Yongmin Liu,Yuan Wang,Cheng Sun,Guy Bartal,Angelica M Stacy,Xiang Zhang"
10.1103/PhysRevLett.99.153901,Subwavelength Discrete Solitons In Nonlinear Metamaterials,PHYSICAL REVIEW LETTERS,2007,"Yongmin Liu,Guy Bartal,Dentcho A Genov,Xiang Zhang"
10.1063/1.2450651,Midinfrared Metamaterials Fabricated By Nanoimprint Lithography,APPLIED PHYSICS LETTERS,2007,"wei wu,zhaoning yu,shihyuan wang,r stanley williams,yongmin liu,cheng sun,xiang zhang,evgenia kim,y ron shen,nicholas x fang"
10.1109/INOW.2007.4302895,Plasmon resonances of strongly coupled nanodisks,Beijing,2007,"d cho,feng wang,joan s valentine,zhaoning yu,yongmin liu,xiang zhang,y r shen"
10.1007/s00339-006-3834-3,Optical metamaterials at near and mid-IR range fabricated by nanoimprint lithography,Applied Physics A,2007,"Wei Wu,Evgenia Kim,Ekaterina Ponizovskaya,Yongmin Liu,Zhaoning Yu,Nicholas Fang,Y. Ron Shen,Alexander M. Bratkovsky,William Tong,Cheng Sun,Xiang Zhang,Shih-Yuan Wang,R. Stanley Williams"
