doi,标题,期刊,年份,作者
10.1016/j.cej.2022.138240,Grading patterning perovskite nanocrystal-polymer composite films for robust multilevel information encryption and decryption,Chemical Engineering Journal,2023,"Jiaxing Fu,Jingyun Feng,Bori Shi,Yongfeng Zhou,Chang Xue,Mengying Zhang,Yabing Qi,Weijia Wen,Jinbo Wu"
10.1002/adfm.202211097,Metal Halide Perovskite Surfaces with Mixed A-Site Cations: Atomic Structure and Device Stability,ADVANCED FUNCTIONAL MATERIALS,2023,"Jeremy Hieulle,Dae-Yong Son,Afshan Jamshaid,Xin Meng,Collin Stecker,Robin Ohmann,Zonghao Liu,Luis K. Ono,Yabing Qi"
,Recent progress in the development of high-efficiency inverted perovskite solar cells,NPG Asia Materials,2023,"Sanwan Liu,Vasudevan P. Biju,Yabing Qi,Wei Chen,Zonghao Liu"
,"Recent Advances in Phosphorene: Structure, Synthesis, and Properties.","Small (Weinheim an der Bergstrasse, Germany)",2023,"Wei Zhang,Xuan Zhang,Luis K Ono,Yabing Qi,Hamid Oughaddou"
,Constructing Heterostructure through Bidentate Coordination toward Operationally Stable Inverted Perovskite Solar Cells,SOLAR RRL,2023,"Caiyi Zhang,Ting Guo,Luis K. K. Ono,Shuai Yuan,Tianhao Wu,Hengyuan Wang,Jiahao Zhang,Xiaomin Liu,Xiaomin Huo,Congyang Zhang,Chenfeng Ding,Tongtong Li,Yanbo Wang,Liyuan Han,Yabing Qi"
10.1002/adma.202300169,Graphene-Like Conjugated Molecule as Hole-Selective Contact for Operationally Stable Inverted Perovskite Solar Cells and Modules.,"Advanced materials (Deerfield Beach, Fla.)",2023,"Tianhao Wu,Xiushang Xu,Luis K Ono,Ting Guo,Silvia Mariotti,Chenfeng Ding,Shuai Yuan,Congyang Zhang,Jiahao Zhang,Kirill Mitrofanov,Qizheng Zhang,Saurav Raj,Xiao Liu,Hiroshi Segawa,Penghui Ji,Tongtong Li,Ryota Kabe,Liyuan Han,Akimitsu Narita,Yabing Qi"
,High-Efficiency CsPbI2Br Perovskite Solar Cells with over 83% Fill Factor by Synergistic Effects of a Multifunctional Additive,INORGANIC CHEMISTRY,2023,"Yanqiang Hu,Lijuan Cai,Zong Xu,Zhi Wang,Yifan Zhou,Guangping Sun,Tongming Sun,Yabing Qi,Shufang Zhang,Yanfeng Tang"
,Passivation strategies for enhancing device performance of perovskite solar cells,Nano Energy,2023,"Zhifang Wu,Enbing Bi,Luis K. Ono,Dengbing Li,Osman M. Bakr,Yanfa Yan,Yabing Qi"
,Holistic Strategies Lead to Enhanced Efficiency and Stability of Hybrid Chemical Vapor Deposition Based Perovskite Solar Cells and Modules,ADVANCED ENERGY MATERIALS,2023,"Guoqing Tong,Jiahao Zhang,Tongle Bu,Luis K. Ono,Congyang Zhang,Yuqiang Liu,Chenfeng Ding,Tianhao Wu,Silvia Mariotti,Said Kazaoui,Yabing Qi"
,Modulation of perovskite degradation with multiple-barrier for light-heat stable perovskite solar cells.,Nature communications,2023,"Jing Zhou,Zonghao Liu,Peng Yu,Guoqing Tong,Ruijun Chen,Luis K Ono,Rui Chen,Haixin Wang,Fumeng Ren,Sanwan Liu,Jianan Wang,Zhigao Lan,Yabing Qi,Wei Chen"
,Local Built-In Field at the Sub-nanometric Heterointerface Mediates Cascade Electrochemical Conversion of Lithium-sulfur Batteries,SMALL,2023,"Chenfeng Ding,Mang Niu,Cathal Cassidy,Hyung-Been Kang,Luis K. Ono,Hengyuan Wang,Guoqing Tong,Congyang Zhang,Yuan Liu,Jiahao Zhang,Silvia Mariotti,Tianhao Wu,Yabing Qi"
10.1039/d2tc05491d,A hole injection monolayer enables cost-effective perovskite light-emitting diodes,JOURNAL OF MATERIALS CHEMISTRY C,2023,"Congyang Zhang,Silvia Mariotti,Luis K. Ono,Chenfeng Ding,Kirill Mitrofanov,Caiyi Zhang,Shuai Yuan,Penghui Ji,Jiahao Zhang,Tianhao Wu,Ryota Kabe,Yabing Qi"
10.1002/anie.202112352,Atomic Level Insights into Metal Halide Perovskite Materials by Scanning Tunneling Microscopy and Spectroscopy,ANGEWANDTE CHEMIE-INTERNATIONAL EDITION,2022,"Wei Zhang,Luis K Ono,Jiamin Xue,Yabing Qi"
10.1016/j.jechem.2021.12.019,Synergistic stabilization of CsPbI3 inorganic perovskite via 1D capping and secondary growth,Journal of Energy Chemistry,2022,"Jingya Mi,Yuetian Chen,Xiaomin Liu,Xingtao Wang,Yanfeng Miao,Yabing Qi,Yixin Zhao"
10.1007/s40820-022-00842-4,Heterogeneous FASnI3 Absorber with Enhanced Electric Field for High-Performance Lead-Free Perovskite Solar Cells,Nano-Micro Letters,2022,"Tianhao Wu,Xiao Liu,Xinhui Luo,Hiroshi Segawa,Guoqing Tong,Yiqiang Zhang,Luis K Ono,Yabing Qi,Liyuan Han"
10.1039/d2ta07565b,Understanding the active formation of a cathode-electrolyte interphase (CEI) layer with energy level band bending for lithium-ion batteries,JOURNAL OF MATERIALS CHEMISTRY A,2022,"Taehoon Kim,Luis K. Ono,Yabing Qi"
10.1063/5.0085221,Perovskite solar cells by vapor deposition based and assisted methods,APPLIED PHYSICS REVIEWS,2022,"Yan Jiang,Sisi He,Longbin Qiu,Yixin Zhao,Yabing Qi"
10.1039/d2ee01801b,Elimination of light-induced degradation at the nickel oxide-perovskite heterojunction by aprotic sulfonium layers towards long-term operationally stable inverted perovskite solar cells,ENERGY & ENVIRONMENTAL SCIENCE,2022,"Tianhao Wu,Luis K. Ono,Rengo Yoshioka,Chenfeng Ding,Congyang Zhang,Silvia Mariotti,Jiahao Zhang,Kirill Mitrofanov,Xiao Liu,Hiroshi Segawa,Ryota Kabe,Liyuan Han,Yabing Qi"
10.23919/IEN.2022.0053,Applications of vacuum vapor deposition for perovskite solar cells: A progress review,iEnergy,2022,"Hang Li,Mingzhen Liu,Meicheng Li,Hyesung Park,Nripan Mathews,Yabing Qi,Xiaodan Zhang,Henk J. Bolink,Karl Leo,Michael Graetzel,Chenyi Yi"
10.1016/j.jelechem.2022.116340,Understanding the nucleation and growth of the degenerated surface structure of the layered transition metal oxide cathodes for lithium-ion batteries by operando Raman spectroscopy,Journal of Electroanalytical Chemistry,2022,"Taehoon Kim,Luis K. Ono,Yabing Qi"
10.1002/aenm.202103151,CsI Enhanced Buried Interface for Efficient and UV-Robust Perovskite Solar Cells,ADVANCED ENERGY MATERIALS,2022,"Hang Xu,Yanfeng Miao,Ning Wei,Haoran Chen,Zhixiao Qin,Xiaomin Liu,Xingtao Wang,Yabing Qi,Taiyang Zhang,Yixin Zhao"
10.1021/acs.chemmater.2c00951,"Air-Exposure Induced Dopant Redistribution and Energy Level Shifts in Spin-Coated Spiro-MeOTAD Films (vol 27, pg 562, 2015)",CHEMISTRY OF MATERIALS,2022,"Zafer Hawash,Luis K. Ono,Sonia R. Raga,Michael V. Lee,Yabing Qi"
10.1002/solr.202100458,Recent Progress on Metal Halide Perovskite Solar Minimodules,SOLAR RRL,2022,"Zhichun Yang,Zonghao Liu,Vahid Ahmadi,Wei Chen,Yabing Qi"
10.1038/s41560-022-01039-0,Modulating crystal growth of formamidinium–caesium perovskites for over 200 cm2 photovoltaic sub-modules,Nature Energy,2022,"Tongle Bu,Luis K. Ono,Jing Li,Jie Su,Guoqing Tong,Wei Zhang,Yuqiang Liu,Jiahao Zhang,Jingjing Chang,Said Kazaoui,Fuzhi Huang,Yi-Bing Cheng,Yabing Qi"
10.1039/d2ma00431c,Residual strain reduction leads to efficiency and operational stability improvements in flexible perovskite solar cells,MATERIALS ADVANCES,2022,"Sisi He,Sibo Li,Anning Zhang,Guanshui Xie,Xin Wang,Jun Fang,Yabing Qi,Longbin Qiu"
10.1063/5.0085137,<p>From film to ring: Quasi-circular inorganic lead halide perovskite grain induced growth of uniform lead silicate glass ring structure</p>,APPLIED PHYSICS LETTERS,2022,"Guoqing Tong,Wentao Song,Luis K. Ono,Yabing Qi"
10.1039/d1se01739j,Investigating lithium metal anodes with nonaqueous electrolytes for safe and high-performance batteries,SUSTAINABLE ENERGY & FUELS,2022,"Hui Zhang,Yabing Qi"
10.1016/J.NANOEN.2021.106152,Removal of residual compositions by powder engineering for high efficiency formamidinium-based perovskite solar cells with operation lifetime over 2000 hours,Nano Energy,2021,"Guoqing Tong,Dae-Yong Son,Luis K. Ono,Hyung-Been Kang,Sisi He,Longbin Qiu,Hui Zhang,Yuqiang Liu,Jeremy Hieulle,Yabing Qi"
10.1126/sciadv.abg3749,Slot-Die Coating Large-Area Formamidinium-Cesium Perovskite Film For Efficient And Stable Parallel Solar Module,SCIENCE ADVANCES,2021,"Zhichun Yang,Wenjun Zhang,Shaohang Wu,Hongmei Zhu,Zonghao Liu,Zhiyang Liu,Zhaoyi Jiang,Rui Chen,Jing Zhou,Qian Lu,Zewen Xiao,Lei Shi,Han Chen,Luis K Ono,Shasha Zhang,Yiqiang Zhang,Yabing Qi,Liyuan Han,Wei Chen"
10.1007/s12274-020-3065-5,CsPbBrxI3-x thin films with multiple ammonium ligands for low turn-on pure-red perovskite light-emitting diodes,NANO RESEARCH,2021,"Maowei Jiang,Zhanhao Hu,Luis K. Ono,Yabing Qi"
10.1088/1361-6463/ac196e,A Solid-Liquid Hybrid Electrolyte For Lithium Ion Batteries Enabled By A Single-Body Polymer/Indium Tin Oxide Architecture,JOURNAL OF PHYSICS D-APPLIED PHYSICS,2021,"Taehoon Kim,Dae-Yong Son,Luis K. Ono,Yan Jiang,Yabing Qi"
10.1002/smll.202100244,"Unclonable Micro-Texture With Clonable Micro-Shape Towards Rapid, Convenient, And Low-Cost Fluorescent Anti-Counterfeiting Labels",SMALL,2021,"Yuhong Lin,Hongkun Zhang,Jingyun Feng,Bori Shi,Mengying Zhang,Yuexing Han,Weijia Wen,Tongyi Zhang,Yabing Qi,Jinbo Wu"
10.1038/s41377-021-00515-8,2d Materials For Conducting Holes From Grain Boundaries In Perovskite Solar Cells,LIGHT-SCIENCE & APPLICATIONS,2021,"Peng You,Guanqi Tang,Jiupeng Cao,Dong Shen,Tsz-Wai Ng,Zafer Hawash,Naixiang Wang,Chun-Ki Liu,Wei Lu,Qidong Tai,Yabing Qi,Chun-Sing Lee,Feng Yan"
10.1002/ange.202112352,Atomic Level Insights into Metal Halide Perovskite Materials by Scanning Tunneling Microscopy and Spectroscopy,Angewandte Chemie,2021,"Wei Zhang,Luis K. Ono,Jiamin Xue,Yabing Qi"
10.1007/s40820-021-00675-7,Up-Scalable Fabrication Of Sno2 With Multifunctional Interface For High Performance Perovskite Solar Modules,NANO-MICRO LETTERS,2021,"Guoqing Tong,Luis K Ono,Yuqiang Liu,Hui Zhang,Tongle Bu,Yabing Qi"
10.1039/d1ee01084k,Atomic-Scale Insight Into The Enhanced Surface Stability Of Methylammonium Lead Iodide Perovskite By Controlled Deposition Of Lead Chloride,ENERGY & ENVIRONMENTAL SCIENCE,2021,"Afshan Jamshaid,Zhendong Guo,Jeremy Hieulle,Collin Stecker,Robin Ohmann,Luis K. Ono,Longbin Qiu,Guoqing Tong,Wanjian Yin,Yabing Qi"
10.1002/adfm.202103399,Phase Aggregation Suppression Of Homogeneous Perovskites Processed In Ambient Condition Toward Efficient Light-Emitting Diodes,ADVANCED FUNCTIONAL MATERIALS,2021,"Yuqiang Liu,Tongle Bu,Luis K. Ono,Guoqing Tong,Hui Zhang,Yabing Qi"
10.1002/admi.202101936,Moisture and Oxygen Enhance Conductivity of LiTFSI‐Doped Spiro‐MeOTAD Hole Transport Layer in Perovskite Solar Cells,Advanced Materials Interfaces,2021,"Zafer  Hawash,Luis K. Ono,Yabing  Qi"
10.1016/j.mtnano.2021.100143,Recent progress on all-inorganic metal halide perovskite solar cells,Materials Today Nano,2021,"J. Liang,Y.B. Qi"
10.1002/cssc.202101573,Defect Passivation For Perovskite Solar Cells: From Molecule Design To Device Performance,CHEMSUSCHEM,2021,"Tianhao Wu,Xing Li,Yabing Qi,Yiqiang Zhang,Liyuan Han"
10.1126/science.abh1035,Lead Halide-Templated Crystallization Of Methylamine-Free Perovskite For Efficient Photovoltaic Modules,SCIENCE,2021,"Tongle Bu,Jing Li,Hengyi Li,Congcong Tian,Jie Su,Guoqing Tong,Luis K Ono,Chao Wang,Zhipeng Lin,Nianyao Chai,Xiao-Li Zhang,Jingjing Chang,Jianfeng Lu,Jie Zhong,Wenchao Huang,Yabing Qi,Yi-Bing Cheng,Fuzhi Huang"
10.1016/j.jechem.2021.01.001,Strategies and methods for fabricating high quality metal halide perovskite thin films for solar cells,Journal of Energy Chemistry,2021,"Helian Sun,Pengfei Dai,Xiaotong Li,Jinyan Ning,Shenghao Wang,Yabing Qi"
10.1021/acsenergylett.1c00129,Two-Dimensional Dion-Jacobson Structure Perovskites For Efficient Sky-Blue Light-Emitting Diodes,ACS ENERGY LETTERS,2021,"Yuqiang Liu,Luis K. Ono,Guoqing Tong,Hui Zhang,Yabing Qi"
10.1021/acsnano.1c04867,Atomic Scale Investigation Of The Cupc-Mapbx(3) Interface And The Effect Of Non-Stoichiometric Perovskite Films On Interfacial Structures,ACS NANO,2021,"Collin Stecker,Zhenyu Liu,Jeremy Hieulle,Siming Zhang,Luis K Ono,Guofeng Wang,Yabing Qi"
10.1039/d1ta06459b,Metal Halide Perovskite Solar Cells By Modified Chemical Vapor Deposition,JOURNAL OF MATERIALS CHEMISTRY A,2021,"Longbin Qiu,Sisi He,Yan Jiang,Yabing Qi"
10.1038/s41467-021-24976-y,Long-Life Lithium-Sulfur Batteries With High Areal Capacity Based On Coaxial Cnts@Tin-Tio2 Sponge,NATURE COMMUNICATIONS,2021,"Hui Zhang,Luis K Ono,Guoqing Tong,Yuqiang Liu,Yabing Qi"
10.1007/s40820-021-00672-w,The Main Progress Of Perovskite Solar Cells In 2020-2021,NANO-MICRO LETTERS,2021,"Tianhao Wu,Zhenzhen Qin,Yanbo Wang,Yongzhen Wu,Wei Chen,Shufang Zhang,Molang Cai,Songyuan Dai,Jing Zhang,Jian Liu,Zhongmin Zhou,Xiao Liu,Hiroshi Segawa,Hairen Tan,Qunwei Tang,Junfeng Fang,Yaowen Li,Liming Ding,Zhijun Ning,Yabing Qi,Yiqiang Zhang,Liyuan Han"
10.1002/AENM.202003712,Scalable Fabrication of >90 cm2 Perovskite Solar Modules with >1000 h Operational Stability Based on the Intermediate Phase Strategy,Advanced Energy Materials,2021,"Guoqing Tong,Dae‐Yong Son,Luis K. Ono,Yuqiang Liu,Yanqiang Hu,Hui Zhang,Afshan Jamshaid,Longbin Qiu,Zonghao Liu,Yabing Qi"
10.1002/admi.202101936,"Moisture and Oxygen Enhance Conductivity of LiTFSI-Doped Spiro-MeOTAD Hole Transport Layer in Perovskite Solar Cells (vol 3, 1600117, 2016)",ADVANCED MATERIALS INTERFACES,2021,"Zafer Hawash,Luis K. Ono,Yabing Qi"
10.1021/acsenergylett.1c01380,Narrow-Band Violet-Light-Emitting Diodes Based on Stable Cesium Lead Chloride Perovskite Nanocrystals,ACS ENERGY LETTERS,2021,"Congyang Zhang,Qun Wan,Luis K. Ono,Yuqiang Liu,Weilin Zheng,Qinggang Zhang,Mingming Liu,Long Kong,Liang Li,Yabing Qi"
,The Main Progress of Perovskite Solar Cells in 2020–2021,Nano-Micro Letters,2021,"Tianhao Wu,Zhenzhen Qin,Yanbo Wang,Yongzhen Wu,Wei Chen,Shufang Zhang,Molang Cai,Songyuan Dai,Jing Zhang,Jian Liu,Zhongmin Zhou,Xiao Liu,Hiroshi Segawa,Hairen Tan,Qunwei Tang,Junfeng Fang,Yaowen Li,Liming Ding,Zhijun Ning,Yabing Qi,Yiqiang Zhang,Liyuan Han"
10.1021/jacs.1c07757,Spectral Stable Blue-Light-Emitting Diodes via Asymmetric Organic Diamine Based Dion-Jacobson Perovskites,JOURNAL OF THE AMERICAN CHEMICAL SOCIETY,2021,"Yuqiang Liu,Luis K Ono,Guoqing Tong,Tongle Bu,Hui Zhang,Chenfeng Ding,Wei Zhang,Yabing Qi"
10.1039/d1qm00279a,Metal Halide Perovskite-Based Flexible Tandem Solar Cells: Next-Generation Flexible Photovoltaic Technology,MATERIALS CHEMISTRY FRONTIERS,2021,"Yan Jiang,Yabing Qi"
10.1002/anie.201905521,Reducing Detrimental Defects for High-Performance Metal Halide Perovskite Solar Cells.,ANGEWANDTE CHEMIE-INTERNATIONAL EDITION,2020,"Luis K Ono,Shengzhong Liu,Yabing Qi"
10.1002/aenm.201902726,Progress of Surface Science Studies on ABX3‐Based Metal Halide Perovskite Solar Cells,ADVANCED ENERGY MATERIALS,2020,"Longbin Qiu,Sisi He,Luis K. Ono,Yabing Qi"
10.1002/aenm.202000908,The Impact of Atmosphere on Energetics of Lead Halide Perovskites,ADVANCED ENERGY MATERIALS,2020,"Zhanhao Hu,Zonghao Liu,Luis K. Ono,Maowei Jiang,Sisi He,Dae-Yong Son,Yabing Qi"
10.1016/j.nanoen.2020.105134,In-situ passivation perovskite targeting efficient light-emitting diodes via spontaneously formed silica network,Nano Energy,2020,"Yuqiang Liu,Lei Cai,Yafeng Xu,Junnan Li,Yuanshuai Qin,Tao Song,Lu Wang,Youyong Li,Luis K. Ono,Yabing Qi,Baoquan Sun"
10.1002/cptc.202000143,Photon Upconverting Solid Films With Improved Efficiency For Endowing Perovskite Solar Cells With Near-Infrared Sensitivity,CHEMPHOTOCHEM,2020,"Mika Kinoshita,Yoichi Sasaki,Shogo Amemori,Naoyuki Harada,Zhanhao Hu,Zonghao Liu,Luis K. Ono,Yabing Qi,Nobuhiro Yanai,Nobuo Kimizuka"
10.1021/acsami.0c01056,Inverse Growth of Large Grain Size and Stable Inorganic Perovskite Micro-Nanowire Photodetectors.,ACS applied materials & interfaces,2020,"Guoqing Tong,Maowei Jiang,Dae-Yong Son,Longbin Qiu,Zonghao Liu,Luis K Ono,Yabing Qi"
10.1039/d0ta09007g,Rapid Hybrid Chemical Vapor Deposition For Efficient And Hysteresis-Free Perovskite Solar Modules With An Operation Lifetime Exceeding 800 Hours,JOURNAL OF MATERIALS CHEMISTRY A,2020,"Longbin Qiu,Sisi He,Zonghao Liu,Luis K. Ono,Dae-Yong Son,Yuqiang Liu,Guoqing Tong,Yabing Qi"
10.1103/PhysRevMaterials.4.044604,Approaching Isotropic Transfer Integrals In Crystalline Organic Semiconductors,PHYSICAL REVIEW MATERIALS,2020,"Qijing Wang,Emilio J. Juarez-Perez,Sai Jiang,Mingfei Xiao,Jun Qian,Eul-Yong Shin,Yong-Young Noh,Yabing Qi,Yi Shi,Yun Li"
10.1002/ente.201900961,Recent Progress of all Bromide Inorganic Perovskite Solar Cells,ENERGY TECHNOLOGY,2020,"Guoqing Tong,Luis K. Ono,Yabing Qi"
10.1039/c9tc04780h,Interface Engineering Strategies towards Cs2AgBiBr6 Single-Crystalline Photodetectors with Good Ohmic Contact Behaviors,JOURNAL OF MATERIALS CHEMISTRY C,2020,"Yangyang Dang,Guoqing Tong,Wentao Song,Zonghao Liu,Longbin Qiu,Luis K. Ono,Yabing Qi"
10.1039/c9tc04780h,Interface engineering strategies towards Cs<sub>2</sub>AgBiBr<sub>6</sub> single-crystalline photodetectors with good Ohmic contact behaviours,Journal of Materials Chemistry C,2020,"Yangyang Dang,Guoqing Tong,Wentao Song,Zonghao Liu,Longbin Qiu,Luis K. Ono,Yabing Qi"
10.1016/j.matt.2019.10.006,Efficient Anti-solvent-free Spin-Coated and Printed Sn-Perovskite Solar Cells with Crystal-Based Precursor Solutions,Matter,2020,"Lintao He,Hao Gu,Xiaolong Liu,Pengwei Li,Yangyang Dang,Chao Liang,Luis K. Ono,Yabing Qi,Xutang Tao"
10.1016/j.jechem.2019.11.008,Additives in Metal Halide Perovskite Films and Their Applications in Solar Cells,Journal of Energy Chemistry,2020,"Zonghao Liu,Luis K. Ono,Yabing Qi"
10.1021/acs.jpcc.9b10191,Surface Termination-Dependent Nanotribological Properties of Single-Crystal MAPbBr3 Surfaces,JOURNAL OF PHYSICAL CHEMISTRY C,2020,"Joong Il Jake Choi,Muhammad Ejaz Khan,Zafer Hawash,Hyunhwa Lee,Luis K. Ono,Yabing Qi,Yong-Hoon Kim,Jeong Young Park"
10.1038/s41560-020-0653-2,"A holistic approach to interface stabilization for efficient perovskite solar modules with over 2,000-hour operational stability",NATURE ENERGY,2020,"Zonghao Liu,Longbin Qiu,Luis K. Ono,Sisi He,Zhanhao Hu,Maowei Jiang,Guoqing Tong,Zhifang Wu,Yan Jiang,Dae-Yong Son,Yangyang Dang,Said Kazaoui,Yabing Qi"
10.1016/j.scib.2019.11.026,Increase the rigidity and hydrophobicity of perovskite by a molecular design,Science Bulletin,2020,Yabing Qi
10.1002/adfm.202002526,2d Derivative Phase Induced Growth Of 3d All Inorganic Perovskite Micro-Nanowire Array Based Photodetectors,ADVANCED FUNCTIONAL MATERIALS,2020,"Guoqing Tong,Maowei Jiang,Dae‐Yong Son,Luis K. Ono,Yabing Qi"
10.1002/inf2.12098,Organic Additive Engineering Toward Efficient Perovskite Light-Emitting Diodes,INFOMAT,2020,"Yuqiang Liu,Luis K. Ono,Yabing Qi"
10.1002/aenm.201903696,Highly Efficient Perovskite Solar Cells Enabled by Multiple Ligand Passivation,ADVANCED ENERGY MATERIALS,2020,"Zhifang Wu,Maowei Jiang,Zonghao Liu,Afshan Jamshaid,Luis K. Ono,Yabing Qi"
10.1002/ANGE.201905521,Verringerung schädlicher Defekte für leistungsstarke Metallhalogenid‐Perowskit‐Solarzellen,Angewandte Chemie,2020,"Luis K. Ono,Shengzhong (Frank) Liu,Yabing Qi"
10.1002/anie.201905521,Reducing Detrimental Defects for High‐Performance Metal Halide Perovskite Solar Cells,Angewandte Chemie International Edition,2020,"Luis K. Ono,Shengzhong (Frank) Liu,Yabing Qi"
10.1002/admi.202000423,Energy Level Alignment at Interfaces in Metal Halide Perovskite Solar Cells,Advanced Materials Interfaces,2020,"Shenghao Wang,Takeaki Sakurai,Weijia Wen,Yabing Qi"
10.1021/acs.jpcc.9b10191,Surface Termination-Dependent Nanotribological Properties Of Single-Crystal Mapbbr(3) Surfaces,JOURNAL OF PHYSICAL CHEMISTRY C,2020,"Joong Il Jake Choi,Muhammad Ejaz Khan,Zafer Hawash,Hyunhwa Lee,Luis K. Ono,Yabing Qi,Yong-Hoon Kim,Jeong Young Park"
10.1002/aenm.202003594,"Progress Of Surface Science Studies On Abx(3)-Based Metal Halide Perovskite Solar Cells (Vol 10, 1902726, 2020)",ADVANCED ENERGY MATERIALS,2020,"Longbin Qiu,Sisi He,Luis K. Ono,Yabing Qi"
10.1002/admi.202000423,"Energy Level Alignment at Interfaces in Metal Halide Perovskite Solar Cells (vol 5, 1800260, 2018)",ADVANCED MATERIALS INTERFACES,2020,"Shenghao Wang,Takeaki Sakurai,Weijia Wen,Yabing Qi"
10.1016/j.mser.2020.100545,How far are we from attaining 10-year lifetime for metal halide perovskite solar cells?,Materials Science and Engineering: R: Reports,2020,"Sisi He,Longbin Qiu,Luis K. Ono,Yabing Qi"
10.1021/acs.jpclett.9b03738,Imaging of the Atomic Structure of All-Inorganic Halide Perovskites.,JOURNAL OF PHYSICAL CHEMISTRY LETTERS,2020,"Jeremy Hieulle,Shulin Luo,Dae-Yong Son,Afshan Jamshaid,Collin Stecker,Zonghao Liu,Guangren Na,Dongwen Yang,Robin Ohmann,Luis K Ono,Lijun Zhang,Yabing Qi"
10.1002/adma.201804284,Highly Efficient and Stable Perovskite Solar Cells via Modification of Energy Levels at the Perovskite/Carbon Electrode Interface.,ADVANCED MATERIALS,2019,"Zhifang Wu,Zonghao Liu,Zhanhao Hu,Zafer Hawash,Longbin Qiu,Yan Jiang,Luis K Ono,Yabing Qi"
10.1021/acsnano.9b06585,Surface Defect Dynamics in Organic-Inorganic Hybrid Perovskites: From Mechanism to Interfacial Properties.,ACS nano,2019,"Collin Stecker,Kexi Liu,Jeremy Hieulle,Robin Ohmann,Zhenyu Liu,Luis K Ono,Guofeng Wang,Yabing Qi"
10.1039/C9TA05883D,Atomic-scale view of stability and degradation of single-crystal MAPbBr3 surfaces,Journal of Materials Chemistry,2019,"Joong Il Jake Choi,Muhammad Ejaz Khan,Zafer Hawash,Ki Jeong Kim,Hyunhwa Lee,Luis K. Ono,Yabing Qi,Yong-Hoon Kim,Jeong Young Park"
,Atomic-Scale Study Of The Degradation Process On Single-Crystal Perovskite Surfaces: From Ultra-High Vacuum To Ambient Pressures,ABSTRACTS OF PAPERS OF THE AMERICAN CHEMICAL SOCIETY,2019,"Joong Il Jake Choi,Muhammad Khan,Jafer Hawash,Hyunhwa Lee,Luis Ono,Yabing Qi,Yong-Hoon Kim,Jeong Young Park"
10.23919/AM-FPD.2019.8830584,Perovskite Material and Solar Cell Research by Surface Science and Advanced Characterization,2019 26th International Workshop on Active-Matrix Flatpanel Displays and Devices (AM-FPD),2019,Yabing Qi
10.23919/AM-FPD.2019.8830563,Influences of Spiro-MeOTAD Hole Transport Layer on the Long-term Stabilities of Perovskite-based Solar Cells,2019 26th International Workshop on Active-Matrix Flatpanel Displays and Devices (AM-FPD),2019,"Luis K. Ono,Yabing Qi"
10.1002/admi.201801785,Elucidating the Mechanism Involved in the Performance Improvement of Lithium‐Ion Transition Metal Oxide Battery by Conducting Polymer,ADVANCED MATERIALS INTERFACES,2019,"Taehoon Kim,Luis K. Ono,Yabing Qi"
10.1039/c9ta06035a,Accelerating hole extraction by inserting 2D Ti3C2-MXene interlayer to all inorganic perovskite solar cells with long-term stability,JOURNAL OF MATERIALS CHEMISTRY A,2019,"Taotao Chen,Guoqing Tong,Enze Xu,Huan Li,Pengcheng Li,Zhifeng Zhu,Jianxin Tang,Yabing Qi,Yang Jiang"
10.1038/s41467-018-07951-y,Highly Stable And Efficient All-Inorganic Lead-Free Perovskite Solar Cells With Native-Oxide Passivation,NATURE COMMUNICATIONS,2019,"Min Chen,Ming-Gang Ju,Hector F Garces,Alexander D Carl,Luis K Ono,Zafer Hawash,Yi Zhang,Tianyi Shen,Yabing Qi,Ronald L Grimm,Domenico Pacifici,Xiao Cheng Zeng,Yuanyuan Zhou,Nitin P Padture"
10.1038/s41598-019-42359-8,Significant Thz Absorption In Ch3nh2 Molecular Defect-Incorporated Organic-Inorganic Hybrid Perovskite Thin Film,SCIENTIFIC REPORTS,2019,"Inhee Maeng,Young Mi Lee,Jinwoo Park,Sonia R Raga,Chul Kang,Chul-Sik Kee,Byung Deok Yu,Suklyun Hong,Luis K Ono,Yabing Qi,Min-Cherl Jung,Masakazu Nakamura"
10.1038/s41560-019-0406-2,Reduction of lead leakage from damaged lead halide perovskite solar modules using self-healing polymer-based encapsulation,NATURE ENERGY,2019,"Yan Jiang,Longbin Qiu,Emilio J. Juarez-Perez,Luis K. Ono,Zhanhao Hu,Zonghao Liu,Zhifang Wu,Lingqiang Meng,Qijing Wang,Yabing Qi"
10.1002/aenm.201803047,Negligible-Pb-Waste and Upscalable Perovskite Deposition Technology for High-Operational-Stability Perovskite Solar Modules,ADVANCED ENERGY MATERIALS,2019,"Yan Jiang,Mikas Remeika,Zhanhao Hu,Emilio J. Juarez-Perez,Longbin Qiu,Zonghao Liu,Taehoon Kim,Luis K. Ono,Dae-Yong Son,Zafer Hawash,Matthew R. Leyden,Zhifang Wu,Lingqiang Meng,Jinsong Hu,Yabing Qi"
10.1039/c8ta10513h,"Lithium-ion batteries: outlook on present, future, and hybridized technologies",JOURNAL OF MATERIALS CHEMISTRY A,2019,"Taehoon Kim,Wentao Song,Dae-Yong Son,Luis K. Ono,Yabing Qi"
10.1039/c9ta06035a,Accelerating hole extraction by inserting 2D Ti<sub>3</sub>C<sub>2</sub>-MXene interlayer to all inorganic perovskite solar cells with long-term stability,Journal of Materials Chemistry A,2019,"Taotao Chen,Guoqing Tong,Enze Xu,Huan Li,Pengcheng Li,Zhifeng Zhu,Jianxin Tang,Yabing Qi,Yang Jiang"
10.1021/acsami.9b02374,Degradation mechanism and relative stability of methylammonium halide based perovskites analyzed on the basis of acid-base theory.,ACS applied materials & interfaces,2019,"Emilio J Juarez-Perez,Luis K Ono,Iciar Uriarte,Emilio J Cocinero,Yabing Qi"
10.1021/acsenergylett.9b01396,Scalable Fabrication of Metal Halide Perovskite Solar Cells and Modules,ACS energy letters,2019,"Longbin Qiu,Sisi He,Luis K. Ono,Shengzhong Liu,Yabing Qi"
10.1039/c9ta06058h,Thermal degradation of formamidinium based lead halide perovskites into sym-triazine and hydrogen cyanide observed by coupled thermogravimetry-mass spectrometry analysis,JOURNAL OF MATERIALS CHEMISTRY A,2019,"Emilio José Juarez-Perez,Luis K. Ono,Yabing Qi"
10.1039/C9TA00239A,Hybrid chemical vapor deposition enables scalable and stable Cs-FA mixed cation perovskite solar modules with a designated area of 91.8 cm2 approaching 10% efficiency,Journal of Materials Chemistry,2019,"Longbin Qiu,Sisi He,Yan Jiang,Dae-Yong Son,Luis K. Ono,Zonghao Liu,Taehoon Kim,Theodoros Bouloumis,Said Kazaoui,Yabing Qi"
10.1002/solr.201900030,High Efficient Hole Extraction and Stable All-Bromide Inorganic Perovskite Solar Cells via Derivative-Phase Gradient Bandgap Architecture,SOLAR RRL,2019,"Guoqing Tong,Taotao Chen,Huan Li,Wentao Song,Yajing Chang,Jingjing Liu,Linwei Yu,Jun Xu,Yabing Qi,Yang Jiang"
10.1021/acsenergylett.9b02032,Engineering Green-to-Blue Emitting CsPbBr3 Quantum-Dot Films with Efficient Ligand Passivation,ACS energy letters,2019,"Maowei Jiang,Zhanhao Hu,Zonghao Liu,Zhifang Wu,Luis K. Ono,Yabing Qi"
10.1016/j.nanoen.2019.104015,Phase transition induced recrystallization and low surface potential barrier leading to 10.91%-efficient CsPbBr3 perovskite solar cells,Nano Energy,2019,"Guoqing Tong,Taotao Chen,Huan Li,Longbin Qiu,Zonghao Liu,Yangyang Dang,Wentao Song,Luis K. Ono,Yang Jiang,Yabing Qi"
