doi,标题,期刊,年份,作者
10.1103/PhysRevB.76.035408,Scattering Of Surface Plasmon Polaritons At Abrupt Surface Interfaces: Implications For Nanoscale Cavities,PHYSICAL REVIEW B,2007,"R. F. Oulton,D. F. P. Pile,Y. Liu,X. Zhang"
10.1103/PhysRevB.76.073101,Magnetic Plasmon Hybridization And Optical Activity At Optical Frequencies In Metallic Nanostructures,PHYSICAL REVIEW B,2007,"H. Liu,D. A. Genov,D. M. Wu,Y. M. Liu,Z. W. Liu,C. Sun,S. N. Zhu,X. Zhang"
10.1117/12.681492,Negative Group Velocity Of Surface Plasmons On Thin Metallic Films,PLASMONICS: METALLIC NANOSTRUCTURES AND THEIR OPTICAL PROPERTIES IV,2006,"yongmin liu,david f pile,zhaowei liu,dongmin wu,cheng sun,xiang zhang"
10.1103/PhysRevLett.97.243902,Magnetic Plasmon Propagation Along A Chain Of Connected Subwavelength Resonators At Infrared Frequencies,PHYSICAL REVIEW LETTERS,2006,"H. Liu,D. A. Genov,D. M. Wu,Y. M. Liu,J. M. Steele,C. Sun,S. N. Zhu,X. Zhang"
10.1103/PhysRevB.69.165109,Dimerlike Positional Correlation And Resonant Transmission Of Electromagnetic Waves In Aperiodic Dielectric Multilayers,PHYSICAL REVIEW B,2004,"R. Peng,Y. Liu,X. Huang,F. Qiu,Mu Wang,A. Hu,S. Jiang,D. Feng,L. Ouyang,J. Zou"
10.1103/PhysRevB.67.205209,Resonant Scattering In Random-Polymer Chains With Inversely Symmetric Impurities,PHYSICAL REVIEW B,2003,"Y. Liu,R. Peng,X. Huang,Mu Wang,A. Hu,S. Jiang"
10.1209/epl/i2003-00608-x,Resonant transmission and frequency trifurcation of light waves in Thue-Morse dielectric multilayers,EUROPHYSICS LETTERS,2003,"F Qiu,R. W Peng,X. Q Huang,Y. M Liu,M Wang,A Hu,S. S Jiang"
10.1088/0953-8984/14/30/314,Persistent currents in k-component Fibonacci mesoscopic rings threaded by a magnetic flux,JOURNAL OF PHYSICS-CONDENSED MATTER,2002,"Y M Liu,R W Peng,G J Jin,X Q Huang,Mu Wang,A Hu,S S Jiang"
