doi,标题,期刊,年份,作者
10.1038/s41467-023-36533-w,Spatially confined protein assembly in hierarchical mesoporous metal-organic framework.,Nature communications,2023,"Xiaoliang Wang,Lilin He,Jacob Sumner,Shuo Qian,Qiu Zhang,Hugh O'Neill,Yimin Mao,Chengxia Chen,Abdullah M Al-Enizi,Ayman Nafady,Shengqian Ma"
,Thermodynamics and Phase Behavior of Poly(ethylene oxide)/ Poly(methyl methacrylate)/Salt Blend Electrolytes Studied by Small- Angle Neutron Scattering,MACROMOLECULES,2023,"Neel J. Shah,Lilin He,Kevin W. Gao,Nitash P. Balsara"
,Revealing the Correlation between the Solvation Structures and the Transport Properties of Water-in-Salt Electrolytes,Chemistry of Materials,2023,"Xinyi Liu,Shao-Chun Lee,Soenke Seifert,Lilin He,Changwoo Do,Randall E. Winans,Gihan Kwon,Y Z,Tao Li"
10.1021/acsaem.2c03682,Quaternized Polynorbornene Random Copolymers for Fuel Cell Devices,ACS APPLIED ENERGY MATERIALS,2023,"Michelle Lehmann,Daniel Leonard,Jackie Zheng,Lilin He,Xiaomin Tang,Xi Chelsea Chen,Katie Heeyum Lim,Sandip Maurya,Yu Seung Kim,Tomonori Saito"
10.1038/s41598-023-30757-y,Grain boundary widening controls siderite (FeCO 3 ) replacement of limestone (CaCO 3 ).,Scientific reports,2023,"Juliane Weber,Vitalii Starchenko,Jan Ilavsky,Lawrence F Allard,Jitendra Mata,Lisa Debeer-Schmitt,Carolyn Grace Cooke,Ken Littrell,Lilin He,Rui Zhang,Andrew G Stack,Lawrence M Anovitz"
,Chimney-Shaped Phase Diagram in a Polymer Blend Electrolyte.,ACS macro letters,2023,"Neel J Shah,Marwan Shalaby,Lilin He,Xin Wang,David Deslandes,Bruce A Garetz,Nitash P Balsara"
10.1021/acs.langmuir.1c02738,"Manipulating Assemblies in Metallosupramolecular Gels, Driven by Isomeric Ligands, Metal Coordination, and Adaptive Binary Gelator Systems",LANGMUIR,2022,"Arnab Dawn,Jinnipha Pajoubpong,Amira Mesmer,Marzieh Mirzamani,Lilin He,Harshita Kumari"
10.1039/d2cp01826h,Structural insights into self-assembly of a slow-evolving and mechanically robust supramolecular gel via time-resolved small-angle neutron scattering.,Physical chemistry chemical physics : PCCP,2022,"Marzieh Mirzamani,Arnab Dawn,Christopher J Garvey,Lilin He,Hilmar Koerner,Harshita Kumari"
,Where Does Sulfur Precipitate in Lithium Sulfur Batteries? an Operando SANS Experiment,ECS Meeting Abstracts,2022,"Charl Jafta,Sylvain Prévost,Lilin He,Mengya Li,Xiao-Guang Sun,Guang Yang,Ilias Belharouak,Jagjit Nanda"
10.1021/acs.macromol.2c01724,Relationship between Ion Transport and Phase Behavior in Acetal-Based Polymer Blend Electrolytes Studied by Electrochemical Characterization and Neutron Scattering,MACROMOLECULES,2022,"Jaeyong Lee,Kevin W. Gao,Neel J. Shah,Cheol Kang,Rachel L. Snyder,Brooks A. Abel,Lilin He,Susana C. M. Teixeira,Geoffrey W. Coates,Nitash P. Balsara"
10.1016/j.softx.2022.101101,drtsans: The data reduction toolkit for small-angle neutron scattering at Oak Ridge National Laboratory,SoftwareX,2022,"William T. Heller,John Hetrick,Jean Bilheux,Jose M. Borreguero Calvo,Wei-Ren Chen,Lisa DeBeer-Schmitt,Changwoo Do,Mathieu Doucet,Michael R. Fitzsimmons,William F. Godoy,Garrett E. Granroth,Steven Hahn,Lilin He,Fahima Islam,Jiao Lin,Kenneth C. Littrell,Marshall McDonnell,Jesse McGaha,Peter F. Peterson,Sai Venkatesh Pingali,Shuo Qian,Andrei T. Savici,Yingrui Shang,Christopher B. Stanley,Volker S. Urban,Ross E. Whitfield,Chen Zhang,Wenduo Zhou,Jay Jay Billings,Matthew J. Cuneo,Ricardo M. Ferraz Leal,Tianhao Wang,Bin Wu"
10.1039/d2cp01826h,Structural Insights into Self-Assembly of a Slow-Evolving and Mechanically Robust Supramolecular Gel via Time-resolved SANS,Physical Chemistry Chemical Physics,2022,"Marzieh Mirzamani,Arnab Dawn,Christopher J. Garvey,Lilin He,Hilmar Koerner,Harshita Kumari"
10.2139/ssrn.4043788,Drtsans: The Data Reduction Toolkit for Small-Angle Neutron Scattering at Oak Ridge National Laboratory,Social Science Research Network,2022,"William  T. Heller,John Hetrick,Jean Bilheux,Jose  M. Borreguero Calvo,Wei-Ren Chen,Lisa Debeer-Schmitt,Changwoo Do,Mathieu Doucet,Michael  R. Fitzsimmons,William  F. Godoy,Garrett  E. Granroth,Steven Hahn,Lilin He,Fahima Islam,Jiao Lin,Kenneth  C. Littrell,Marshall McDonnell,Jesse McGaha,Peter  F. Peterson,Sai Venkatesh Pingali,Shuo Qian,Andrei  T. Savici,Yingrui Shang,Christopher  B. Stanley,Volker  S. Urban,Ross  E. Whitfield,Chen Zhang,Wenduo Zhuo,Jay Jay Billings,Matthew  J. Cuneo,Ricardo  M. Ferraz Leal,Tianhao Wang,Bin Wu"
,Chemomechanical Influences During Replacement of Limestones by Siderite,Goldschmidt2022 abstracts,2022,"Juliane Weber,Vitaliy Starchenko,Jan Ilavsky,Lawrence Anovitz,Lisa Debeer-Schmitt,Jitendra Mata,Ken Littrell,Lilin He,Rui Zhang,Andrew Stack,Wei-Ren Chen,Lawrence Allard"
10.3390/batteries8020012,Reduced Graphene Oxide Aerogels with Functionalization-Mediated Disordered Stacking for Sodium-Ion Batteries,BATTERIES-BASEL,2022,"Jaehyeung Park,Jaswinder Sharma,Charl J. Jafta,Lilin He,Harry M. Meyer,Jianlin Li,Jong K. Keum,Ngoc A. Nguyen,Georgios Polizos"
10.1080/00268976.2021.1905190,Characterisation Of Nano-Assemblies Inside Mesopores Using Neutron Scattering*,MOLECULAR PHYSICS,2021,"Yingzhen Ma,William T. Heller,Lilin He,William A. Shelton,Gernot Rother,Bhuvnesh Bharti"
10.1016/j.ensm.2021.05.016,"Quantifying The Chemical, Electrochemical Heterogeneity And Spatial Distribution Of (Poly) Sulfide Species Using Operando Sans",ENERGY STORAGE MATERIALS,2021,"Charl J. Jafta,Sylvain Prévost,Lilin He,Mengya Li,Xiao-Guang Sun,Guang Yang,Ilias Belharouak,Jagjit Nanda"
10.1021/acsanm.1c02873,In Situ Polymerization of Polypyrrole and Polyaniline on the Surface of Magnetic Molybdenum Trioxide Nanoparticles: Implications for Water Treatment,ACS APPLIED NANO MATERIALS,2021,"Sofia K. Fanourakis,Sharona Q. Barroga,Jem Valerie D. Perez,Lilin He,Debora F. Rodrigues"
10.1021/acs.est.1c03862,Degradation Of Adsorbed Bisphenol A By Soluble Mn(Iii),ENVIRONMENTAL SCIENCE & TECHNOLOGY,2021,"Yanchen Sun,Jeongdae Im,Nusrat Shobnam,Sofia K Fanourakis,Lilin He,Lawrence M Anovitz,Paul R Erickson,Huihui Sun,Jie Zhuang,Frank E Löffler"
10.3390/app11031216,A Unified User-Friendly Instrument Control And Data Acquisition System For The Ornl Sans Instrument Suite,APPLIED SCIENCES-BASEL,2021,"Xingxing Yao,Blake Avery,Miljko Bobrek,Lisa Debeer-Schmitt,Xiaosong Geng,Ray Gregory,Greg Guyotte,Mike Harrington,Steven Hartman,Lilin He,Luke Heroux,Kay Kasemir,Rob Knudson,James Kohl,Carl Lionberger,Kenneth Littrell,Matthew Pearson,Sai Venkatesh Pingali,Cody Pratt,Shuo Qian,Mariano Ruiz-Rodriguez,Vladislav Sedov,Gary Taufer,Volker Urban,Klemen Vodopivec"
10.1021/acs.jpcc.1c02288,Investigating Multiscale Spatial Distribution Of Sulfur In A Cnt Scaffold And Its Impact On Li-S Cell Performance,JOURNAL OF PHYSICAL CHEMISTRY C,2021,"Guang Yang,Runming Tao,Charl J. Jafta,Chao Shen,Sheng Zhao,Lilin He,Ilias Belharouak,Jagjit Nanda"
10.1002/anie.201916201,Observation of Ion Electrosorption in Metal-Organic Framework Micropores with in operando Small-Angle Neutron Scattering.,ANGEWANDTE CHEMIE-INTERNATIONAL EDITION,2020,"Lilin He,Luming Yang,Rui Zhang,Jianlin Li,Mircea Dinca"
10.1021/acs.energyfuels.0c00109,Characterizing anisotropic pore structure and its impact on gas storage and transport in coalbed methane and shale gas reservoirs,ENERGY & FUELS,2020,"Rui Zhang,Shimin Liu,Lilin He,Tomasz P Blach,Yi Wang"
10.1149/ma2020-02592958mtgabs,Ionic Liquids at the Electrode Interface: Insights into Surface Passivation and Framework Expansion of Hard Carbon Anodes,Meeting abstracts,2020,"Craig A. Bridges,Xiao-Guang Sun,Bingkun Guo,William Heller,Lilin He,Mariappan Parans Paranthaman,Sheng Dai"
10.1107/S1600576719001110,Anomalous neutron scattering `halo' observed in highly oriented pyrolytic graphite,JOURNAL OF APPLIED CRYSTALLOGRAPHY,2019,"Lilin He,Chen Li,William A. Hamilton,Tao Hong,Xin Tong,Barry L. Winn,Lowell Crow,Katherine Bailey,Nidia C. Gallego"
10.1107/S1600576719001110,Anomalous Neutron Scattering 'Halo' Observed In Hignly Oriented Pyrolytic Graphite,JOURNAL OF APPLIED CRYSTALLOGRAPHY,2019,"Lilin He,Chen Li,William A. Hamilton,Tao Hong,Xin Tong,Barry L. Winn,Lowell Crow,Katherine Bailey,Nidia C. Gallego"
10.1021/acsami.9b08496, Discovering Inherent Characteristics of Polyethylenimine-Functionalized Porous Materials for CO2 Capture.,ACS applied materials & interfaces,2019,"Rui Zhang,Xiaoxing Wang,Shimin Liu,Lilin He,Chunshan Song,Xiao Jiang,Tomasz Blach"
10.1107/S0108767319096855,Small-angle Neutron Scattering Study of Enzyme Encapsulation in Nanoporous Metal-Organic Frameworks,ACTA CRYSTALLOGRAPHICA A-FOUNDATION AND ADVANCES,2019,"Lilin He,Xiaoliang Wang,Shuo Qian,Shenqian Ma"
10.1021/acsami.9b04553,Understanding the Static Interfacial Polymer Layer by Exploring the Dispersion States of Nanocomposites.,ACS applied materials & interfaces,2019,"Anne-Caroline Genix,Vera Bocharova,Bobby Carroll,Michelle Lehmann,Tomonori Saito,Susan Krueger,Lilin He,Philippe Dieudonné-George,Alexei P Sokolov,Julian Oberdisse"
10.1103/PhysRevLett.123.239802,Palit et al. Reply.,PHYSICAL REVIEW LETTERS,2019,"Swomitra Palit,Lilin He,William A Hamilton,Arun Yethiraj,Anand Yethiraj"
10.1016/j.coal.2018.11.009,"Nanopore characterization of mine roof shales by SANS, nitrogen adsorption, and mercury intrusion: Impact on water adsorption/retention behavior",International Journal of Coal Geology,2018,"Guijie Sang,Shimin Liu,Rui Zhang,Derek Elsworth,Lilin He"
10.1021/acs.chemmater.7b03502,Manganoporphyrin-Polyphenol Multilayer Capsules as Radical and Reactive Oxygen Species (ROS) Scavengers,CHEMISTRY OF MATERIALS,2018,"Aaron Alford,Veronika Kozlovskaya,Bing Xue,Nirzari Gupta,William Higgins,Dana Pham-Hua,Lilin He,Volker S. Urban,Hubert M. Tse,Eugenia Kharlampieva"
10.1107/S1600576718001231,The suite of small-angle neutron scattering instruments at Oak Ridge National Laboratory,JOURNAL OF APPLIED CRYSTALLOGRAPHY,2018,"William T. Heller,Matthew J. Cuneo,L. DeBeer-Schmitt,Changwoo Do,Lilin He,Luke Heroux,Kenneth C. Littrell,Sai Venkatesh Pingali,Shuo Qian,Christopher J. Stanley,Volker S. Urban,Bin Wu,Wim Bras"
10.1021/acs.energyfuels.8b03437,Evaluation of nanoscale accessible pore structures for improved prediction of gas production potential in Chinese marine shales,ENERGY & FUELS,2018,"Yang Wang,Yong Qin,Rui Zhang,Lilin He,Lawrence M. Anovitz,Markus Bleuel,David F.R. Mildner,Shimin Liu,Yanming Zhu"
10.1107/S160057671800479X,Small-angle neutron scattering measurements of δ-phase deuteride (hydride) precipitates in Zircaloy 4,JOURNAL OF APPLIED CRYSTALLOGRAPHY,2018,"Brent J Heuser,Jun Li Lin,Changwoo Do,Lilin He"
10.1021/acs.macromol.8b00432,Do Very Small Poss Nanoparticles Perturb S-Pmma Chain Conformations?,MACROMOLECULES,2018,"Nicolas Jouault,Sanat K. Kumar,Robert J. Smalley,Changzai Chi,Robert Moneta,Barbara A. Wood,Holly Salerno,Yuri B. Melnichenko,Lilin He,William E. Guise,Boualem Hammouda,Michael K. Crawford"
10.1039/c7cp07197c,Strain heterogeneity in sheared colloids revealed by neutron scattering.,PHYSICAL CHEMISTRY CHEMICAL PHYSICS,2018,"Kevin Chen,Bin Wu,Lilin He,Gregory S Smith,Changwoo Do,Guan-Rong Huang,Gaibo Zhang,Yangyang Wang"
10.1107/S160057671800479X,Small-Angle Neutron Scattering Measurements Of Delta-Phase Deuteride (Hydride) Precipitates In Zircaloy 4,JOURNAL OF APPLIED CRYSTALLOGRAPHY,2018,"Brent J. Heuser,Jun-Li Lin,Changwoo Do,Lilin He"
10.1063/1.5023595,Detection Of Vapor Nanobubbles By Small Angle Neutron Scattering (Sans),APPLIED PHYSICS LETTERS,2018,"Emilian Popov,Lilin He,Elvis E. Dominguez-Ontiveros,Yuri Melnichenko"
10.1016/j.nanoen.2018.06.045,Pseudocapacitive storage via micropores in high-surface area molybdenum nitrides,Nano Energy,2018,"Abdoulaye Djire,Jason B. Siegel,Olabode T. Ajenifujah,Lilin He,Levi T. Thompson"
10.1103/PhysRevLett.118.097801,Combining Diffusion NMR and Small-Angle Neutron Scattering Enables Precise Measurements of Polymer Chain Compression in a Crowded Environment.,PHYSICAL REVIEW LETTERS,2017,"Swomitra Palit,Lilin He,William A Hamilton,Arun Yethiraj,Anand Yethiraj"
10.1021/acsenergylett.7b00472,Observing Framework Expansion of Ordered Mesoporous Hard Carbon Anodes with Ionic Liquid Electrolytes via in Situ Small-Angle Neutron Scattering,ACS energy letters,2017,"Craig A. Bridges,Xiao-Guang Sun,Bingkun Guo,William T. Heller,Lilin He,M. Paranthaman,Sheng Dai"
,"Neutron Scattering ""Halo'' Observed in Highly Oriented Pyrolytic Graphite",Bulletin of the American Physical Society,2017,"Lilin He,William A. Hamilton,Tao Hong,Lowell Crow,Bailey Katherine,Nidia C. Gallego"
,Evidence of LLPS in melts of broadly distributed ethylene copolymers via deuterium labeling and effect on self-nucleation and crystallization,Bulletin of the American Physical Society,2017,"Xuejian Chen,G. D. Wignall,Lilin He,Rufina G. Alamo"
10.1021/acs.jpclett.7b00755,Controlling the Intermediate Structure of an Ionic Liquid for f-Block Element Separations.,JOURNAL OF PHYSICAL CHEMISTRY LETTERS,2017,"Carter W Abney,Changwoo Do,Huimin Luo,Joshua Wright,Lilin He,Sheng Dai"
10.1021/acs.macromol.7b00357,SANS Evidence of Liquid–Liquid Phase Separation Leading to Inversion of Crystallization Rate of Broadly Distributed Random Ethylene Copolymers,MACROMOLECULES,2017,"Xuejian Chen,George D. Wignall,Lilin He,Carlos Lopez-Barron,Rufina G. Alamo"
10.1021/acs.energyfuels.7b01567,"Effect of Ionic Liquid Pretreatment on the Porosity of Pine: Insights from Small-Angle Neutron Scattering, Nitrogen Adsorption Analysis, and X-ray Diffraction",ENERGY & FUELS,2017,"Xueming Yuan,Lilin He,Seema Singh,Blake A. Simmons,Gang Cheng"
,Supplemental Material : Combining diffusion NMR and SANS enables precise measurements of polymer chain compression in a crowded environment,,2017,"Swomitra  Palit,Lilin  He,William A. Hamilton,Arun  Yethiraj,Anand  Yethiraj"
10.1016/j.biortech.2017.02.014,Characterization of white poplar and eucalyptus after ionic liquid pretreatment as a function of biomass loading using X-ray diffraction and small angle neutron scattering.,Bioresource Technology,2017,"Xueming Yuan,Yonghao Duan,Lilin He,Seema Singh,Blake Simmons,Gang Cheng"
10.1039/c7cp01602f,Aggregation Of Cyclic Polypeptoids Bearing Zwitterionic End-Groups With Attractive Dipole-Dipole And Solvophobic Interactions: A Study By Small-Angle Neutron Scattering And Molecular Dynamics Simulation,PHYSICAL CHEMISTRY CHEMICAL PHYSICS,2017,"Pu Du,Ang Li,Xin Li,Yueheng Zhang,Changwoo Do,Lilin He,Steven W Rick,Vijay T John,Revati Kumar,Donghui Zhang"
10.1039/C7GC00944E,From lignin subunits to aggregates: insights into lignin solubilization,Green Chemistry,2017,"Wenwen Zhao,Ling-Ping Xiao,Guoyong Song,Runcang Sun,Lilin He,Seema Singh,Blake A. Simmons,Gang Cheng"
10.1021/acs.macromol.6b02580,Tuning Biocompatible Block Copolymer Micelles By Varying Solvent Composition: Core/Corona Structure And Solvent Uptake,MACROMOLECULES,2017,"Tyler Cooksey,Avantika Singh,Kim Mai Le,Shu Wang,Elizabeth G. Kelley,Lilin He,Sameer Vajjala Kesava,Enrique D. Gomez,Bryce E. Kidd,Louis A. Madsen,Megan L. Robertson"
,CO$_{2}$ adsorption in a hierarchically structured carbon by SANS,Bulletin of the American Physical Society,2016,"Lilin He,Jitendra Bahadur,Yuri B. Melnichenko,Cristian I. Contescu,Nidia C. Gallego"
10.1021/acsmacrolett.6b00164,Polymer Chain Behavior in Polymer Nanocomposites with Attractive Interactions,ACS Macro Letters,2016,"Nicolas Jouault,Michael Crawford,Changzai Chi,Robert J. Smalley,Barbara Ann Wood,Jacques Jestin,Yuri B. Melnichenko,Lilin He,William Guise,Sanat K. Kumar"
10.1107/S1600576716014904,Determination of closed porosity in rocks by small-angle neutron scattering,JOURNAL OF APPLIED CRYSTALLOGRAPHY,2016,"Jitendra Bahadur,Cristian R. Medina,Lilin He,Yuri B. Melnichenko,John Rupp,Tomasz P. Blach,D.F.R. Mildner"
10.1063/1.4967291,Association Of A Multifunctional Ionic Block Copolymer In A Selective Solvent,JOURNAL OF CHEMICAL PHYSICS,2016,"Thusitha N Etampawala,Dipak Aryal,Naresh C Osti,Lilin He,William T Heller,Carl L Willis,Gary S Grest,Dvora Perahia"
,Current and Future Scientific Investigations at GP-SANS,Bulletin of the American Physical Society,2016,"L. DeBeer-Schmitt,Katherine M. Bailey,Yuri B. Melnichenko,Lilin He,Ken Littrell"
10.1149/ma2016-02/2/190,In Situ Small-Angle Neutron Scattering of Mesoporous Electrode Materials,Meeting abstracts,2016,"Craig A. Bridges,Xiao-Guang Sun,Lilin He,Sheng Dai"
10.1021/acs.macromol.5b02611,"Amidine-Mediated Zwitterionic Ring-Opening Polymerization of N-Alkyl N-Carboxyanhydride: Mechanism, Kinetics, and Architecture Elucidation",MACROMOLECULES,2016,"Ang Li,Lu Lu,Xin Li,Lilin He,Changwoo Do,Jayne C. Garno,Donghui Zhang"
10.1016/j.carbon.2015.08.010,SANS investigations of CO 2 adsorption in microporous carbon,Carbon,2015,"j bahadur,y b melnichenko,lilin he,cristian i contescu,nidia c gallego,j r carmichael"
10.1016/j.nima.2014.11.061,Corrections for the geometric distortion of the tube detectors on SANS instruments at ORNL,"Nuclear Instruments and Methods in Physics Research Section A: Accelerators, Spectrometers, Detectors and Associated Equipment",2015,"lilin he,changwoo do,shuo qian,g d wignall,william t heller,kenneth c littrell,gregory s smith"
10.1039/c5mh00076a,Simultaneous spin-coating and solvent annealing: manipulating the active layer morphology to a power conversion efficiency of 9.6% in polymer solar cells,MATERIALS HORIZONS,2015,"zhicai he,feng liu,cheng wang,jihua chen,lilin he,dennis nordlund,hongbin wu,thomas p russell,yong cao"
10.1016/j.fuel.2015.08.067,Estimation and modeling of coal pore accessibility using small angle neutron scattering,Fuel,2015,"rui zhang,shimin liu,j bahadur,derek elsworth,yuri b melnichenko,lilin he,yi wang"
,"Self-assembled Structures of a Multifunctional, Structured Block Copolymer in Solution; A SANS Study",Bulletin of the American Physical Society,2014,"thusitha etampawala,manjula senanayake,naresh osti,lilin he,william t heller,dvora perahia"
10.1016/j.carbon.2014.08.041,Investigation of morphology and hydrogen adsorption capacity of disordered carbons,Carbon,2014,"lilin he,yuri b melnichenko,nidia c gallego,cristian i contescu,junjie guo,j bahadur"
10.1007/s10570-013-0162-6,Morphological changes in the cellulose and lignin components of biomass occur at different stages during steam pretreatment,Cellulose,2014,"sai venkatesh pingali,hugh m o neill,yoshiharu nishiyama,lilin he,yuri b melnichenko,volker s urban,loukas petridis,b h davison,paul langan"
10.1021/la500963q,Cavitation On Deterministically Nanostructured Surfaces In Contact With An Aqueous Phase: A Small-Angle Neutron Scattering Study,LANGMUIR,2014,"Yuri B Melnichenko,N V Lavrik,E Popov,J Bahadur,L He,I I Kravchenko,G Smith,V Pipich,N K Szekely"
,Applications of Neutron Scattering Techniques for the Characterization of Pore Structure and Fluids Interactions in Tight-Rocks,,2014,"lilin he,t p blach"
10.1021/la502546n,Small Angle Neutron Scattering (Sans) Studies On The Structural Evolution Of Pyromellitamide Self-Assembled Gels,LANGMUIR,2014,"Scott A Jamieson,Katie W K Tong,William A Hamilton,Lilin He,Michael James,Pall Thordarson"
10.1021/nn406077n,In situ small angle neutron scattering revealing ion sorption in microporous carbon electrical double layer capacitors.,ACS nano,2014,"Sofiane Boukhalfa,Daniel Gordon,Lilin He,Yuri B Melnichenko,Naoki Nitta,Alexandre Magasinski,Gleb Yushin"
,Small angle neutron scatterinig for in-situ probing the ion adsorption inside micropores,Science,2013,"sofiane boukhalfa,lilin he,yuri b melnichenko,gleb yushin"
,Microstructural characterization of nanoporous carbon fiber as determined by neutron scattering,Bulletin of the American Physical Society,2013,"Lilin He,Yuri B. Melnichenko,Sofiane Baukhalfa,Gleb Yushin"
10.1002/anie.201209141,Small‐Angle Neutron Scattering for In Situ Probing of Ion Adsorption Inside Micropores,Angewandte Chemie,2013,"Sofiane Boukhalfa,Lilin He,Yuri B. Melnichenko,Gleb Yushin"
10.1021/ef301859s,A USANS/SANS study of the accessibility of pores in the Barnett Shale to methane and water,ENERGY & FUELS,2013,"leslie f ruppert,richard sakurovs,t p blach,lilin he,yuri b melnichenko,d f r mildner,leo alcantarlopez"
10.1007/s00705-013-1650-6,New insight into the structure of RNA in red clover necrotic mosaic virus and the role of divalent cations revealed by small-angle neutron scattering.,ARCHIVES OF VIROLOGY,2013,"Stanton L Martin,Lilin He,Flora Meilleur,Richard H Guenther,Tim L Sit,Steven A Lommel,William T Heller"
10.1016/j.jallcom.2013.04.082,Hydrogen trapping at dislocation cores at room temperature in deformed Pd,Journal of Alloys and Compounds,2013,"brent j heuser,dallas r trinkle,taini yang,lilin he"
10.1021/jp3041583,"Phase Behavior of Carbon Dioxide Confined in Silica Aerogel in the Vicinity of the Bulk Critical Point (vol 115, pg 22336, 2011)",JOURNAL OF PHYSICAL CHEMISTRY C,2012,"Salvino Ciccariello,Yuri B. Melnichenko,Lilin He"
10.1103/PhysRevLett.109.067801,Partial Collapse And Reswelling Of A Polymer In The Critical Demixing Region Of Good Solvents,PHYSICAL REVIEW LETTERS,2012,"Lilin He,Gang Cheng,Yuri B Melnichenko"
10.1074/jbc.M112.380972,"Open Conformation of Ezrin Bound to Phosphatidylinositol 4,5-Bisphosphate and to F-actin Revealed by Neutron Scattering",Journal of Biological Chemistry,2012,"Jayant James Jayasundar,Jeong Ho Ju,Lilin He,Dazhi Liu,Flora Meilleur,Jinkui Zhao,David J E Callaway,Zimei Bu"
,Monitoring phase behavior of hydrogen confined in carbon nanopores by in-situ Small Angle Neutron Scattering technique,,2012,"hongxin zhang,lilin he,yuri b melnichenko,cristian i contescu,nidia c gallego"
10.1016/j.fuel.2011.06.026,Accessibility of pores in coal to methane and carbon dioxide,Fuel,2012,"yuri b melnichenko,lilin he,richard sakurovs,arkady l kholodenko,t p blach,maria mastalerz,andrzej p radlinski,gang cheng,d f r mildner"
10.1128/JVI.06569-11,Conformational changes in Sindbis virus induced by decreased pH are revealed by small-angle neutron scattering.,JOURNAL OF VIROLOGY,2012,"Lilin He,Amanda Piper,Flora Meilleur,Raquel Hernandez,William T Heller,Dennis T Brown"
10.1021/jp3041583,Correction to “Phase Behavior of Carbon Dioxide Confined in Silica Aerogel in the Vicinity of the Bulk Critical Point”,Journal of Physical Chemistry C,2012,"lilin he,salvino ciccariello,yuri b melnichenko"
10.1021/ef201704t,Pore accessibility by methane and carbon dioxide in coal as determined by neutron scattering,Energy & Fuels,2012,"andrzej p radlinski,tomas blach,richard sakurovs,maria mastalerz,yuri b melnichenko,lilin he"
,Polymer Conformation near the Critical Demixing Point of a Binary Solution,Bulletin of the American Physical Society,2012,"lilin he,gang cheng,yuri b melnichenko"
10.1016/j.micromeso.2011.08.035,SMALL-ANGLE NEUTRON SCATTERING CHARACTERIZATION OF THE STRUCTURE OF NANOPOROUS CARBONS FOR ENERGY-RELATED APPLICATIONS,Microporous and Mesoporous Materials,2012,"lilin he,s m chathoth,yuri b melnichenko,volker presser,john k mcdonough,yury gogotsi"
10.1557/opl.2012.1284,Monitoring phase behavior of hydrogen confined in carbon nanopores by in-situ Small Angle Neutron Scattering technique,MRS Online Proceedings Library,2012,"Zhang  Hongxin,He  Lilin,Melnichenko  Yuri B.,Contescu  Cristian I.,Gallego  Nidia C."
10.1016/j.coal.2012.06.005,Pore size distribution and accessible pore size distribution in bituminous coals,International Journal of Coal Geology,2012,"richard sakurovs,lilin he,yuri b melnichenko,andrzej p radlinski,tomas blach,hartmut lemmel,d f r mildner"
10.1021/ef300735t,Porosity of coal and shale: Insights from gas adsorption and SANS/USANS techniques,ENERGY & FUELS,2012,"maria mastalerz,lilin he,yuri b melnichenko,john a rupp"
,Have some large structures? Try small-angle neutron scattering (SANS),,2011,"lisa m debeerschmitt,katherine m bailey,lilin he,g d wignall,yuri melnichenkov,k c littrell"
10.1107/S0021889810045176,Supercritical carbon dioxide behavior in porous silica aerogel,JOURNAL OF APPLIED CRYSTALLOGRAPHY,2011,"salvino ciccariello,yuri b melnichenko,lilin he"
10.1557/opl.2011.1500,Experimental Evidence of Super Densification of Adsorbed Hydrogen by in-situ Small Angle Neutron Scattering (SANS),,2011,"dipendu saha,lilin he,cristian i contescu,nidia c gallego,yuri b melnichenko"
10.1107/S0021889811035631,Supercritical carbon dioxide behaviour in porous silica aerogel. Erratum,JOURNAL OF APPLIED CRYSTALLOGRAPHY,2011,"salvino ciccariello,y b melnichenko,lilin he"
10.1021/jp205189g,Phase behavior of carbon dioxide confined in silica aerogel in the vicinity of the bulk critical point,JOURNAL OF PHYSICAL CHEMISTRY C,2011,"salvino ciccariello,yuri b melnichenko,lilin he"
10.1128/JVI.00044-10,The structure of Sindbis virus produced from vertebrate and invertebrate hosts as determined by small-angle neutron scattering.,JOURNAL OF VIROLOGY,2010,"Lilin He,Amanda Piper,Flora Meilleur,Dean A A Myles,Raquel Hernandez,Dennis T Brown,William T Heller"
,Pore size specific characterization of the adsorption of CO2 and methane in coal using SANS,GEOCHIMICA ET COSMOCHIMICA ACTA,2010,"Yuri B. Melnichenko,Lilin He,Maria Mastalerz"
10.1021/ma900314g,From Solutions to Membranes: Structure Studies of Sulfonated Polyphenylene Ionomers,MACROMOLECULES,2009,"Lilin He,Cy H. Fujimoto,Chris J. Cornelius,Dvora Perahia"
10.1021/ma900973f,Interfacial Effects On Water Penetration Into Ultrathin Ionomer Films: An In Situ Study Using Neutron Reflectometry,MACROMOLECULES,2009,"Lilin He,Hillary L. Smith,Jaroslaw Majewski,Cy H. Fujimoto,Christopher J. Cornelius,Dvora Perahia"
10.1002/pca.995,Identification of antioxidant phenolic compounds in feverfew (Tanacetum parthenium) by HPLC-ESI-MS/MS and NMR.,PHYTOCHEMICAL ANALYSIS,2007,"Changqing Wu,Feng Chen,Xi Wang,Yonnie Wu,Meidui Dong,Guoqing He,Ronald D Galyean,Lilin He,Guohui Huang"
