doi,标题,期刊,年份,作者
10.1175/JCLI-D-22-0335.s1,Influence of Spatial Dipole Pattern in Asian Aerosol Changes on East Asian Summer Monsoon,JOURNAL OF CLIMATE,2023,"Chao Liu,Yang Yang,Hailong Wang,Lili Ren,Jiangfeng Wei,Pinya Wang,Hong Liao"
,Uncertain role of clouds in shaping summertime atmosphere-sea ice connections in reanalyses and CMIP6 models,CLIMATE DYNAMICS,2023,"Rui Luo,Qinghua Ding,Ian Baxter,Xianyao Chen,Zhiwei Wu,Mitchell Bushuk,Hailong Wang"
10.5194/gmd-16-75-2023,Improving snow albedo modeling in the E3SM land model (version 2.0) and assessing its impacts on snow and surface fluxes over the Tibetan Plateau,GEOSCIENTIFIC MODEL DEVELOPMENT,2023,"Dalei Hao,Gautam Bisht,Karl Rittger,Edward Bair,Cenlin He,Huilin Huang,Cheng Dang,Timbo Stillinger,Yu Gu,Hailong Wang,Yun Qian,L. Ruby Leung"
10.5194/tc-17-233-2023,Causes and evolution of winter polynyas north of Greenland,CRYOSPHERE,2023,"Younjoo J. Lee,Wieslaw Maslowski,John J. Cassano,Jaclyn Clement Kinney,Anthony P. Craig,Samy Kamal,Robert Osinski,Mark W. Seefeldt,Julienne Stroeve,Hailong Wang"
10.5194/acp-23-1131-2023,Climate-driven deterioration of future ozone pollution in Asia predicted by machine learning with multi-source data,Atmospheric Chemistry and Physics,2023,"H. Li,Y. Yang,J. Jin,H. Wang,K. Li,P. Wang,H. Liao"
10.1016/j.scib.2023.03.048,Climate effects of future aerosol reductions for achieving carbon neutrality in China.,Science bulletin,2023,"Yang Yang,Liangying Zeng,Hailong Wang,Pinya Wang,Hong Liao"
,"Numerical coupling of aerosol emissions, dry removal, and turbulent
  mixing in the E3SM Atmosphere Model version 1 (EAMv1), part I: dust budget
  analyses and the impacts of a revised coupling scheme",,2023,"Hui Wan,Kai Zhang,Christopher J. Vogl,Carol S. Woodward,Richard C. Easter,Philip J. Rasch,Yan Feng,Hailong Wang"
10.5194/acp-23-1533-2023,Summertime ozone pollution in China affected by stratospheric quasi-biennial oscillation,Atmospheric Chemistry and Physics,2023,"M. Li,Y. Yang,H. Wang,H. Li,P. Wang,H. Liao"
,A cleaner snow future mitigates Northern Hemisphere snowpack loss from warming.,Nature communications,2023,"Dalei Hao,Gautam Bisht,Hailong Wang,Donghui Xu,Huilin Huang,Yun Qian,L Ruby Leung"
,Rapid increase in tropospheric ozone over Southeast Asia attributed to changes in precursor emission source regions and sectors,ATMOSPHERIC ENVIRONMENT,2023,"Su Li,Yang Yang,Hailong Wang,Pengwei Li,Ke Li,Lili Ren,Pinya Wang,Baojie Li,Yuhao Mao,Hong Liao"
10.5194/acp-23-1131-2023,Climate-driven deterioration of future ozone pollution in Asia predicted bymachine learning with multi-source data,ATMOSPHERIC CHEMISTRY AND PHYSICS,2023,"Huimin Li,Yang Yang,Jianbing Jin,Hailong Wang,Ke Li,Pinya Wang,Hong Liao"
,Climate responses in China to domestic and foreign aerosol changes due to clean air actions during 2013–2019,npj Climate and Atmospheric Science,2023,"Jiyuan Gao,Yang Yang,Hailong Wang,Pinya Wang,Baojie Li,Jiandong Li,Jiangfeng Wei,Meng Gao,Hong Liao"
10.1038/s41467-022-29156-0,Publisher Correction: Abrupt emissions reductions during COVID-19 contributed to record summer rainfall in China,Nature Communications,2022,"Yang Yang,Lili Ren,Mingxuan Wu,Hailong Wang,Fengfei Song,L. R. Leung,Xin Hao,Jiandong Li,Lei Chen,Huimin Li,Liangying Zeng,Yang Zhou,Pinya Wang,Hong Liao,Jing Wang,Zhen-Qiang Zhou"
10.1029/2021MS002768,Brown Carbon Fuel and Emission Source Attributions to Global Snow Darkening Effect,JOURNAL OF ADVANCES IN MODELING EARTH SYSTEMS,2022,"Hunter Brown,Hailong Wang,Mark Flanner,Xiaohong Liu,Balwinder Singh,Rudong Zhang,Yang Yang,Mingxuan Wu"
10.5194/acp-22-5223-2022,OCEANFILMS (Organic Compounds from Ecosystems to Aerosols: Natural Films and Interfaces via Langmuir Molecular Surfactants) sea spray organic aerosol emissions - implementation in a global climate model and impacts on clouds,ATMOSPHERIC CHEMISTRY AND PHYSICS,2022,"Susannah M. Burrows,Richard C. Easter,Xiaohong Liu,Po-Lun Ma,Hailong Wang,Scott M. Elliott,Balwinder Singh,Kai Zhang,Philip J. Rasch"
,Long-term Variability in immersion-mode Marine Ice Nucleating Particles from Climate Model Simulations and Observations,,2022,"a raman,t hill,p demott,b singh,k zhang,pl ma,m wu,h wang"
10.1029/2021MS002909,Global Dust Cycle and Direct Radiative Effect in E3SM Version 1: Impact of Increasing Model Resolution,JOURNAL OF ADVANCES IN MODELING EARTH SYSTEMS,2022,"Y. Feng,H. Wang,P. J. Rasch,K. Zhang,W. Lin,Q. Tang,S. Xie,D. S. Hamilton,N. Mahowald,H. Yu"
10.1038/s41467-022-29156-0,"Abrupt emissions reductions during COVID-19 contributed to record summer rainfall in China (vol 13, pg 1, 2022)",NATURE COMMUNICATIONS,2022,"Yang Yang,Lili Ren,Mingxuan Wu,Hailong Wang,Fengfei Song,L. Ruby Leung,Xin Hao,Jiandong Li,Lei Chen,Huimin Li,Liangying Zeng,Yang Zhou,Pinya Wang,Hong Liao,Jing Wang,Zhen-Qiang Zhou"
10.1021/acs.est.1c04380,Projected Aerosol Changes Driven by Emissions and Climate Change Using a Machine Learning Method,ENVIRONMENTAL SCIENCE & TECHNOLOGY,2022,"Huimin Li,Yang Yang,Hailong Wang,Pinya Wang,Xu Yue,Hong Liao"
10.1038/s41467-022-28537-9,Abrupt emissions reductions during COVID-19 contributed to record summer rainfall in China,NATURE COMMUNICATIONS,2022,"Yang Yang,Lili Ren,Mingxuan Wu,Hailong Wang,Fengfei Song,L Ruby Leung,Xin Hao,Jiandong Li,Lei Chen,Huimin Li,Liangying Zeng,Yang Zhou,Pinya Wang,Hong Liao,Jing Wang,Zhen-Qiang Zhou"
10.5194/acp-22-7131-2022,Fast climate responses to emission reductions in aerosol and ozone precursors in China during 2013-2017,ATMOSPHERIC CHEMISTRY AND PHYSICS,2022,"Jiyuan Gao,Yang Yang,Hailong Wang,Pinya Wang,Huimin Li,Mengyun Li,Lili Ren,Xu Yue,Hong Liao"
10.1029/2022JD037067,The Shortwave Radiative Flux Response to an Injection of Sea Salt Aerosols in the Gulf of Mexico,JOURNAL OF GEOPHYSICAL RESEARCH-ATMOSPHERES,2022,"P. B. Goddard,B. Kravitz,D. G. MacMartin,H. Wang"
10.5194/acp-2021-1087,"Effective radiative forcing of anthropogenic aerosols in E3SMv1: historical changes, causality, decomposition, and parameterization sensitivities",ATMOSPHERIC CHEMISTRY AND PHYSICS,2022,"Kai  Zhang,Wentao  Zhang,Hui  Wan,Philip J. Rasch,Steven J. Ghan,Richard C. Easter,Xiangjun  Shi,Yong  Wang,Hailong  Wang,Po-Lun  Ma,Shixuan  Zhang,Jian  Sun,Susannah  Burrows,Manish  Shrivastava,Balwinder  Singh,Yun  Qian,Xiaohong  Liu,Jean-Christophe  Golaz,Qi  Tang,Xue  Zheng,Shaocheng  Xie,Wuyin  Lin,Yan  Feng,Minghuai  Wang,Jin-Ho  Yoon,Ruby L. Leung"
,Dust pollution in China affected by different spatial and temporal types of El Niño,Atmospheric Chemistry and Physics,2022,"Yang Yang,Liangying Zeng,Hailong Wang,Pinya Wang,Hong Liao"
10.1016/j.scitotenv.2022.157785,Summer ozone pollution in China affected by the intensity of Asian monsoon systems,Science of The Total Environment,2022,"Yang Zhou,Yang Yang,Hailong Wang,Jing Wang,Mengyun Li,Huimin Li,Pinya Wang,Jia Zhu,Ke Li,Hong Liao"
10.1016/j.envres.2022.113898,Response of Indian summer monsoon rainfall to remote carbonaceous aerosols at short time scales: Teleconnections and feedbacks,Environmental Research,2022,"A. Asutosh,V. Vinoj,H. Wang,K. Landu,Jin-Ho Yoon"
,Development and Evaluation of E3SM‐MOSAIC: Spatial Distributions and Radiative Effects of Nitrate Aerosol,Journal of Advances in Modeling Earth Systems,2022,"Mingxuan Wu,Hailong Wang,Richard C. Easter,Zheng Lu,Xiaohong Liu,Balwinder Singh,Po‐Lun Ma,Qi Tang,Rahul A. Zaveri,Ziming Ke,Rudong Zhang,Louisa K. Emmons,Simone Tilmes,Jack E. Dibb,Xue Zheng,Shaocheng Xie,L. Ruby Leung"
10.1088/1748-9326/ac54cd,ENSO modulation of summertime tropospheric ozone over China,ENVIRONMENTAL RESEARCH LETTERS,2022,"Yang Yang,Mengyun Li,Hailong Wang,Huimin Li,Pinya Wang,Ke Li,Meng Gao,Hong Liao"
10.1029/2022JD036480,Aircraft Observations of Turbulence in Cloudy and Cloud-Free Boundary Layers over the Western North Atlantic Ocean From ACTIVATE and Implications for the Earth System Model Evaluation and Development,JOURNAL OF GEOPHYSICAL RESEARCH-ATMOSPHERES,2022,"Michael A. Brunke,Lauren Cutler,Rodrigo Delgado Urzua,Andrea F. Corral,Ewan Crosbie,Johnathan Hair,Chris Hostetler,Simon Kirschler,Vincent Larson,Xiang-Yu Li,Po-Lun Ma,Annalisa Minke,Richard Moore,Claire E. Robinson,Amy Jo Scarino,Joseph Schlosser,Michael Shook,Armin Sorooshian,Kenneth Lee Thornhill,Christiane Voigt,Hui Wan,Hailong Wang,Edward Winstead,Xubin Zeng,Shixuan Zhang,Luke D. Ziemba"
10.5194/acp-2022-27,Climate impacts of emission reductions in China during 2013–2017,,2022,"Jiyuan  Gao,Yang  Yang,Hailong  Wang,Pinya  Wang,Huimin  Li,Mengyun  Li,Lili  Ren,Xu  Yue,Hong  Liao"
10.1175/JAS-D-21-0123.1,Large-Eddy Simulations of Marine Boundary Layer Clouds Associated with Cold-Air Outbreaks during the ACTIVATE Campaign. Part I: Case Setup and Sensitivities to Large-Scale Forcings,JOURNAL OF THE ATMOSPHERIC SCIENCES,2022,"Xiang-Yu Li,Hailong Wang,Jingyi Chen,Satoshi Endo,Geet George,Brian Cairns,Seethala Chellappan,Xubin Zeng,Simon Kirschler,Christiane Voigt,Armin Sorooshian,Ewan Crosbie,Gao Chen,Richard Anthony Ferrare,William I. Gustafson,Johnathan W Hair,Mary M Kleb,Hongyu Liu,Richard Moore,David Painemal,Claire Robinson,Amy Jo Scarino,Michael Shook,Taylor J Shingler,Kenneth Lee Thornhill,Florian Tornow,Heng Xiao,Luke D Ziemba,Paquita Zuidema"
10.5194/acp-22-14489-2022,Dust pollution in China affected by different spatial and temporal types ofEl Nino,ATMOSPHERIC CHEMISTRY AND PHYSICS,2022,"Yang Yang,Liangying Zeng,Hailong Wang,Pinya Wang,Hong Liao"
10.1029/2021JD036148,Diurnal Rainfall Response to the Physiological and Radiative Effects of CO2 in Tropical Forests in the Energy Exascale Earth System Model v1,JOURNAL OF GEOPHYSICAL RESEARCH-ATMOSPHERES,2022,"Bryce E. Harrop,Susannah M. Burrows,Katherine Calvin,Gabriel J. Kooperman,L. Ruby Leung,Mathew E. Maltrud,Xiaoying Shi,Jinyun Tang,Qi Tang,Hailong Wang,Qing Zhu"
10.1029/2022MS002995,Deep Learning Provides Substantial Improvements to County-Level Fire Weather Forecasting Over the Western United States,JOURNAL OF ADVANCES IN MODELING EARTH SYSTEMS,2022,"Rackhun Son,Po-Lun Ma,Hailong Wang,Philp J. Rasch,Shih-Yu (Simon) Wang,Hyungjun Kim,Jee-Hoon Jeong,Kyo-Sun Sunny Lim,Jin-Ho Yoon"
10.1029/2022gl099308,Widespread wildfires over the western United States in 2020 linked to emissions reductions during COVID‐19,Geophysical Research Letters,2022,"Lili Ren,Yang Yang,Hailong Wang,Pinya Wang,Xu Yue,Hong Liao"
10.5194/acp-2021-328-supplement,"Supplementary material to ""Aerosol transport pathways and source attribution in China during the COVID-19 outbreak""",,2021,"Lili  Ren,Yang  Yang,Hailong  Wang,Pinya  Wang,Lei  Chen,Jia  Zhu,Hong  Liao"
10.1029/2020JD033423,"An Overview Of Atmospheric Features Over The Western North Atlantic Ocean And North American East Coast-Part 2: Circulation, Boundary Layer, And Clouds",JOURNAL OF GEOPHYSICAL RESEARCH-ATMOSPHERES,2021,"David Painemal,Andrea F. Corral,Armin Sorooshian,Michael A. Brunke,Seethala Chellappan,Vesta Afzali Gorooh,Seung-Hee Ham,Larry O'Neill,William L. Smith,George Tselioudis,Hailong Wang,Xubin Zeng,Paquita Zuidema"
10.1029/2021JD034809,Radiative Forcing Of Nitrate Aerosols From 1975 To 2010 As Simulated By Mosaic Module In Cesm2-Mam4,JOURNAL OF GEOPHYSICAL RESEARCH-ATMOSPHERES,2021,"Z. Lu,X. Liu,R. A. Zaveri,R. C. Easter,S. Tilmes,L. K. Emmons,F. Vitt,B. Singh,H. Wang,R. Zhang,P. J. Rasch"
10.1175/JAS-D-21-0324.1,"Large-eddy simulations of marine boundary-layer clouds associated with
  cold air outbreak during the ACTIVATE campaign. Part II:
  aerosol-meteorology-cloud interaction",,2021,"Xiang-Yu Li,Hailong Wang,Jingyi Chen,Satoshi Endo,Simon Kirschler,Christiane Voigt,Ewan Crosbie,Luke D Ziemba,David Painemal,Brian Cairns,Johnathan W Hair,Andrea F. Corral,Claire Robinson,Hossein Dadashazar,Armin Sorooshian,Gao Chen,Richard Anthony Ferrare,Mary M Kleb,Hongyu Liu,Richard Moore,Amy Jo Scarino,Michael A. Shook,Taylor J Shingler,Kenneth Lee Thornhill,Florian Tornow,Heng Xiao,Xubin Zeng"
10.1029/2021GL094364,On Assessing Era5 And Merra2 Representations Of Cold-Air Outbreaks Across The Gulf Stream,GEOPHYSICAL RESEARCH LETTERS,2021,"C Seethala,Paquita Zuidema,James Edson,Michael Brunke,Gao Chen,Xiang-Yu Li,David Painemal,Claire Robinson,Taylor Shingler,Michael Shook,Armin Sorooshian,Lee Thornhill,Florian Tornow,Hailong Wang,Xubin Zeng,Luke Ziemba"
10.1029/2021gl094364,On Assessing ERA5 and MERRA2 Representations of Cold‐Air Outbreaks Across the Gulf Stream,Geophysical Research Letters,2021,"C. Seethala,Paquita Zuidema,James Edson,Michael Brunke,Gao Chen,Xiang‐Yu Li,David Painemal,Claire Robinson,Taylor Shingler,Michael Shook,Armin Sorooshian,Lee Thornhill,Florian Tornow,Hailong Wang,Xubin Zeng,Luke Ziemba"
10.5194/tc-2021-279,Causes and Evolution of Winter Polynyas over North of Greenland,,2021,"Younjoo J. Lee,Wieslaw  Maslowski,John J. Cassano,Jaclyn  Clement Kinney,Anthony P. Craig,Samy  Kamal,Robert  Osinski,Mark W. Seefeldt,Julienne  Stroeve,Hailong  Wang"
10.1016/j.envpol.2020.115778,Black carbon deposited in Hariqin Glacier of the Central Tibetan Plateau record changes in the emission from Eurasia,Environmental Pollution,2021,"Mo Wang,Baiqing Xu,Hailong Wang,Rudong Zhang,Yang Yang,Shaopeng Gao,Xiangxiang Tang,Ninglian Wang"
10.5194/acp-21-10745-2021,Intensified Modulation Of Winter Aerosol Pollution In China By El Nino With Short Duration,ATMOSPHERIC CHEMISTRY AND PHYSICS,2021,"Liangying Zeng,Yang Yang,Hailong Wang,Jing Wang,Jing Li,Lili Ren,Huimin Li,Yang Zhou,Pinya Wang,Hong Liao"
10.5194/acp-21-15431-2021,Aerosol transport pathways and source attribution in China during the COVID-19 outbreak,ATMOSPHERIC CHEMISTRY AND PHYSICS,2021,"Lili Ren,Yang Yang,Hailong Wang,Pinya Wang,Lei Chen,Jia Zhu,Hong Liao"
10.1016/j.scitotenv.2020.144263,Constructing A Spatiotemporally Coherent Long-Term Pm2.5 Concentration Dataset Over China During 1980-2019 Using A Machine Learning Approach,SCIENCE OF THE TOTAL ENVIRONMENT,2021,"Huimin Li,Yang Yang,Hailong Wang,Baojie Li,Pinya Wang,Jiandong Li,Hong Liao"
10.5194/acp-21-10499-2021,"Cloud Drop Number Concentrations Over The Western North Atlantic Ocean: Seasonal Cycle, Aerosol Interrelationships, And Other Influential Factors",ATMOSPHERIC CHEMISTRY AND PHYSICS,2021,"Hossein Dadashazar,David Painemal,Majid Alipanah,Michael Brunke,Seethala Chellappan,Andrea F. Corral,Ewan Crosbie,Simon Kirschler,Hongyu Liu,Richard Moore,Claire Robinson,Amy Jo Scarino,Michael Shook,Kenneth Sinclair,K. Lee Thornhill,Christiane Voigt,Hailong Wang,Edward Winstead,Xubin Zeng,Luke Ziemba,Paquita Zuidema,Armin Sorooshian"
10.5194/acp-21-16121-2021,Aerosol responses to precipitation along North American air trajectories arriving at Bermuda,ATMOSPHERIC CHEMISTRY AND PHYSICS,2021,"Hossein Dadashazar,Majid Alipanah,Miguel Ricardo A Hilario,Ewan Crosbie,Simon Kirschler,Hongyu Liu,Richard H Moore,Andrew J Peters,Amy Jo Scarino,Michael Shook,K Lee Thornhill,Christiane Voigt,Hailong Wang,Edward Winstead,Bo Zhang,Luke Ziemba,Armin Sorooshian"
10.5194/ACP-2021-166,Intensified modulation of aerosol pollution in China by El Niño with short duration,Atmospheric Chemistry and Physics,2021,"Liangying Zeng,Yang Yang,Hailong Wang,Jing Wang,Jing Li,Lili Ren,Huimin Li,Yang Zhou,Pinya Wang,Hong Liao"
10.1029/2020GL091883,The Climate Response To Emissions Reductions Due To Covid-19: Initial Results From Covidmip,GEOPHYSICAL RESEARCH LETTERS,2021,"Chris D. Jones,Jonathan E. Hickman,Steven T. Rumbold,Jeremy Walton,Robin D. Lamboll,Ragnhild B. Skeie,Stephanie Fiedler,Piers M. Forster,Joeri Rogelj,Manabu Abe,Michael Botzet,Katherine Calvin,Christophe Cassou,Jason N.S. Cole,Paolo Davini,Makoto Deushi,Martin Dix,John C. Fyfe,Nathan P. Gillett,Tatiana Ilyina,Michio Kawamiya,Maxwell Kelley,Slava Kharin,Tsuyoshi Koshiro,Hongmei Li,Chloe Mackallah,Wolfgang A. Müller,Pierre Nabat,Twan van Noije,Paul Nolan,Rumi Ohgaito,Dirk Olivié,Naga Oshima,Jose Parodi,Thomas J. Reerink,Lili Ren,Anastasia Romanou,Roland Séférian,Yongming Tang,Claudia Timmreck,Jerry Tjiputra,Etienne Tourigny,Kostas Tsigaridis,Hailong Wang,Mingxuan Wu,Klaus Wyser,Shuting Yang,Yang Yang,Tilo Ziehn"
10.1175/JCLI-D-21-0193.1,The Influence of Fire Aerosols on Surface Climate and Gross Primary Production in the Energy Exascale Earth System Model (E3SM),JOURNAL OF CLIMATE,2021,"Li Xu,Qing Zhu,William J. Riley,Yang Chen,Hailong Wang,Po-Lun Ma,James T. Randerson"
10.1016/j.scitotenv.2020.142712,Simulated Aging Processes Of Black Carbon And Its Impact During A Severe Winter Haze Event In The Beijing-Tianjin-Hebei Region,SCIENCE OF THE TOTAL ENVIRONMENT,2021,"Donglin Chen,Hong Liao,Yang Yang,Lei Chen,Hailong Wang"
10.1029/2020MS002346,Development And Evaluation Of Chemistry-Aerosol-Climate Model Cam5-Chem-Mam7-Mosaic: Global Atmospheric Distribution And Radiative Effects Of Nitrate Aerosol,JOURNAL OF ADVANCES IN MODELING EARTH SYSTEMS,2021,"Rahul A. Zaveri,Richard C. Easter,Balwinder Singh,Hailong Wang,Zheng Lu,Simone Tilmes,Louisa K. Emmons,Francis Vitt,Rudong Zhang,Xiaohong Liu,Steven J. Ghan,Philip J. Rasch"
10.1029/2020JD032592,"An Overview Of Atmospheric Features Over The Western North Atlantic Ocean And North American East Coast - Part 1: Analysis Of Aerosols, Gases, And Wet Deposition Chemistry",JOURNAL OF GEOPHYSICAL RESEARCH-ATMOSPHERES,2021,"Andrea F Corral,Rachel A Braun,Brian Cairns,Vesta Afzali Gorooh,Hongyu Liu,Lin Ma,Ali Hossein Mardi,David Painemal,Snorre Stamnes,Bastiaan van Diedenhoven,Hailong Wang,Yang Yang,Bo Zhang,Armin Sorooshian"
10.1029/2021GL095011,Atmospheric Circulation Patterns Conducive to Severe Haze in Eastern China Have Shifted Under Climate Change,GEOPHYSICAL RESEARCH LETTERS,2021,"Yang Yang,Yang Zhou,Ke Li,Hailong Wang,Lili Ren,Liangying Zeng,Huimin Li,Pinya Wang,Baojie Li,Hong Liao"
10.1038/s41467-021-26232-9,Increasing large wildfires over the western United States linked to diminishing sea ice in the Arctic,NATURE COMMUNICATIONS,2021,"Yufei Zou,Philip J Rasch,Hailong Wang,Zuowei Xie,Rudong Zhang"
10.1029/2021GL094878,Understanding The Cold Season Arctic Surface Warming Trend In Recent Decades,GEOPHYSICAL RESEARCH LETTERS,2021,"Rudong Zhang,Hailong Wang,Qiang Fu,Philip J. Rasch,Mingxuan Wu,Wieslaw Maslowski"
,Hybridizing Machine Learning and Physically-based Earth System Models to Improve Prediction of Multivariate Extreme Events (AI Exploration of Wildland Fire Prediction),,2021,"y zou,pj rasch,h wang"
10.1016/j.powtec.2020.03.070,Filtration of dust in an electrostatically enhanced granular bed filter for high temperature gas cleanup,Powder Technology,2020,"J.F. Xi,Z.Z. Gu,J. Cai,J. Zhang,H.C. Wang,S.F. Wang"
10.5194/acp-20-139-2020,Interannual Variability and Trends of Combustion Aerosol and Dust in Major Continental Outflows Revealed by MODIS Retrievals and CAM5 Simulations During 2003–2017,ATMOSPHERIC CHEMISTRY AND PHYSICS,2020,"Hongbin Yu,Yang Yang,Hailong Wang,Qian Tan,Mian Chin,Robert C. Levy,Lorraine A. Remer,Steven J. Smith,Tianle Yuan,Yingxi Shi"
10.5194/tc-14-429-2020,Influence of sea-ice anomalies on Antarctic precipitation using source attribution in the Community Earth System Model,CRYOSPHERE,2020,"Hailong Wang,Jeremy G. Fyke,Jan T. M. Lenaerts,Jesse M. Nusbaumer,Hansi Singh,David Noone,Philip J. Rasch,Rudong Zhang"
10.1016/j.cllc.2020.02.015,A Preliminary Study of Adoptive T-cell Transfer Therapy for Non-small Cell Lung Adenocarcinoma Patients with Brain Metastasis: A Case Report of 3 Patients,Clinical Lung Cancer,2020,"Hailong Wang,Pengfei Liu,Jiahui Mi,Junhui Chen,Yong Liu"
10.5194/GMD-2020-228,System identification techniques for detection of teleconnections within climate models,Geoscientific Model Development Discussions,2020,"Bethany Sutherland,Ben Kravitz,Philip J. Rasch,Hailong Wang"
10.5194/acp-20-613-2020,Surprising similarities in model and observational aerosol radiative forcing estimates,ATMOSPHERIC CHEMISTRY AND PHYSICS,2020,"Edward Gryspeerdt,Johannes Mülmenstädt,Andrew Gettelman,Florent F. Malavelle,Hugh Morrison,David Neubauer,Daniel G. Partridge,Philip Stier,Toshihiko Takemura,Hailong Wang,Minghuai Wang,Kai Zhang"
10.1016/j.quascirev.2020.106525,Improved accuracy of U-series and radiocarbon dating of ostrich eggshell using a sample preparation method based on microstructure and geochemistry: A study from the Middle Stone Age of Northwestern Ethiopia,QUATERNARY SCIENCE REVIEWS,2020,"S.L. Loewy,J. Valdes,H. Wang,B. Ingram,N.R. Miller,K.de la Cruz Medina,A. Roberts,S. Yanny,J. Banner,M. Feseha,L. Todd,J. Kappelman"
10.26355/eurrev_202003_20685,Transcription factor ZNF703 activates linc-UBC1 to stimulate the progression of glioma.,EUROPEAN REVIEW FOR MEDICAL AND PHARMACOLOGICAL SCIENCES,2020,"J Wang,L-S Zhu,Y Luo,C-H Wang,Y-Y Wei,L-M Zhou"
10.5194/acp-20-13835-2020,Understanding Processes That Control Dust Spatial Distributions With Global Climate Models And Satellite Observations,ATMOSPHERIC CHEMISTRY AND PHYSICS,2020,"Mingxuan Wu,Xiaohong Liu,Hongbin Yu,Hailong Wang,Yang Shi,Kang Yang,Anton Darmenov,Chenglai Wu,Zhien Wang,Tao Luo,Yan Feng,Ziming Ke"
10.1029/2020GL088063,Assessing Global and Local Radiative Feedbacks Based on AGCM Simulations for 1980-2014/2017,GEOPHYSICAL RESEARCH LETTERS,2020,"Rudong Zhang,Hailong Wang,Qiang Fu,Philip J. Rasch"
10.1175/JCLI-D-20-0169.1,Tracking Moisture Sources Of Precipitation Over Central Asia: A Study Based On The Water-Source-Tagging Method,JOURNAL OF CLIMATE,2020,"Jie Jiang,Tianjun Zhou,Hailong Wang,Yun Qian,David Noone,Wenmin Man"
10.1029/2020GL089788,Fast Climate Responses to Aerosol Emission Reductions During the COVID‐19 Pandemic,Geophysical Research Letters,2020,"Yang Yang,Lili Ren,Huimin Li,Hailong Wang,Pinya Wang,Lei Chen,Xu Yue,Hong Liao"
10.1029/2020MS002266,New Soa Treatments Within The Energy Exascale Earth System Model (E3sm): Strong Production And Sinks Govern Atmospheric Soa Distributions And Radiative Forcing,JOURNAL OF ADVANCES IN MODELING EARTH SYSTEMS,2020,"Sijia Lou,Manish Shrivastava,Richard C. Easter,Yang Yang,Po‐Lun Ma,Hailong Wang,Michael J. Cubison,Pedro Campuzano‐Jost,Jose L. Jimenez,Qi Zhang,Philip J. Rasch,John E. Shilling,Alla Zelenyuk,Manvendra Dubey,Philip Cameron‐Smith,Scot T. Martin,Johannes Schneider,Christiane Schulz"
10.5194/ACP-2020-3,Source attribution of Arctic aerosols and associated Arctic warming trend during 1980–2018,Atmospheric Chemistry and Physics,2020,"Lili Ren,Yang Yang,Hailong Wang,Rudong Zhang,Pinya Wang,Hong Liao"
10.5194/acp-20-2579-2020,Trends and source apportionment of aerosols in Europe during 1980–2018,ATMOSPHERIC CHEMISTRY AND PHYSICS,2020,"Yang Yang,Sijia Lou,Hailong Wang,Pinya Wang,Hong Liao"
10.5194/acp-20-4999-2020,Atmospheric teleconnection processes linking winter air stagnation and haze extremes in China with regional Arctic sea ice decline,ATMOSPHERIC CHEMISTRY AND PHYSICS,2020,"Yufei Zou,Yuhang Wang,Zuowei Xie,Hailong Wang,Philip J. Rasch"
10.5194/acp-20-9067-2020,Source attribution of Arctic black carbon and sulfate aerosols and associated Arctic surface warming during 1980-2018,ATMOSPHERIC CHEMISTRY AND PHYSICS,2020,"Lili Ren,Yang Yang,Hailong Wang,Rudong Zhang,Pinya Wang,Hong Liao"
10.1016/j.earscirev.2020.103346,A Review Of Black Carbon In Snow And Ice And Its Impact On The Cryosphere,EARTH-SCIENCE REVIEWS,2020,"Shichang Kang,Yulan Zhang,Yun Qian,Hailong Wang"
10.1029/2019MS001766,The DOE E3SM v1.1 Biogeochemistry Configuration: Description and Simulated Ecosystem-Climate Responses to Historical Changes in Forcing,JOURNAL OF ADVANCES IN MODELING EARTH SYSTEMS,2020,"S. M. Burrows,M. Maltrud,X. Yang,Q. Zhu,N. Jeffery,X. Shi,D. Ricciuto,S. Wang,G. Bisht,J. Tang,J. Wolfe,B. E. Harrop,B. Singh,L. Brent,S. Baldwin,T. Zhou,P. Cameron-Smith,N. Keen,N. Collier,M. Xu,E. C. Hunke,S. M. Elliott,A. K. Turner,H. Li,H. Wang,J-C Golaz,B. Bond-Lamberty,F. M. Hoffman,W. J. Riley,P. E. Thornton,K. Calvin,L. R. Leung"
10.1029/2019MS001851,Aerosols in the E3SM Version 1: New Developments and Their Impacts on Radiative Forcing,JOURNAL OF ADVANCES IN MODELING EARTH SYSTEMS,2020,"Hailong Wang,Richard C. Easter,Rudong Zhang,Po‐Lun Ma,Balwinder Singh,Kai Zhang,Dilip Ganguly,Philip J. Rasch,Susannah M. Burrows,Steven J. Ghan,Sijia Lou,Yun Qian,Yang Yang,Yan Feng,Mark Flanner,Ruby L. Leung,Xiaohong Liu,Manish Shrivastava,Jian Sun,Qi Tang,Shaocheng Xie,Jin‐Ho Yoon"
10.1175/BAMS-D-19-0320.1,Facilitating International Collaboration on Climate Change Research,BULLETIN OF THE AMERICAN METEOROLOGICAL SOCIETY,2020,"Hao He,Hailong Wang,Zhaoyong Guan,Haishan Chen,Qiang Fu,Muyin Wang,Xiquan Dong,Chunguang Cui,Likun Wang,Bin Wang,Gang Chen,Zhanqing Li,Da-lin Zhang"
10.1029/2019JD031626,Atmospheric Research Over the Western North Atlantic Ocean Region and North American East Coast: A Review of Past Work and Challenges Ahead,JOURNAL OF GEOPHYSICAL RESEARCH-ATMOSPHERES,2020,"Armin Sorooshian,Andrea F. Corral,Rachel A. Braun,Brian Cairns,Ewan Crosbie,Richard Ferrare,Johnathan Hair,Mary M. Kleb,Ali Hossein Mardi,Hal Maring,Allison McComiskey,Richard Moore,David Painemal,Amy Jo Scarino,Joseph Schlosser,Taylor Shingler,Michael Shook,Hailong Wang,Xubin Zeng,Luke Ziemba,Paquita Zuidema"
10.1016/j.envpol.2019.113541,Light-absorbing impurities accelerating glacial melting in southeastern Tibetan Plateau.,Environmental Pollution,2020,"Hewen Niu,Shichang Kang,Hailong Wang,Jiankuo Du,Tao Pu,Guotao Zhang,Xixi Lu,Xingguo Yan,Shijin Wang,Xiaofei Shi"
10.1097/PTS.0000000000000205,Bibliometric Analysis of Medication Errors and Adverse Drug Events Studies.,JOURNAL OF PATIENT SAFETY,2019,"h c huang,c h wang,p c chen,yu der lee"
10.1029/2018JD030001,Impact of Anthropogenic Emission Injection Height Uncertainty on Global Sulfur Dioxide and Aerosol Distribution,JOURNAL OF GEOPHYSICAL RESEARCH-ATMOSPHERES,2019,"Yang Yang,Steven J. Smith,Hailong Wang,Sijia Lou,Philip J. Rasch"
