doi,标题,期刊,年份,作者
10.1016/j.atmosres.2022.106535,Effects of aerosols on the forecasting of Mei-yu frontal storms over the Yangtze–Huai River valley,Atmospheric Research,2023,"Lin Liu,Huiling Yuan,Yi Deng,Jing Ren,Yongqing Bai,Chunguang Cui"
,Quantitative attribution of the temperature associated with winter extreme cold events in China,CLIMATE DYNAMICS,2023,"Weiwei Wang,Tuantuan Zhang,Junwen Chen,Qingquan Li,Song Yang,Yi Deng"
10.1175/JCLI-D-22-0150.1,A Hierarchical Dissection of Multiscale Forcing on the Springtime Mesoscale Convective Systems in the United States,JOURNAL OF CLIMATE,2023,"Zhenyu You,Yi Deng"
10.1007/s00376-022-2107-1,Analysis of the Characteristics of the Low-level Jets in the Middle Reaches of the Yangtze River during the Mei-yu Season,ADVANCES IN ATMOSPHERIC SCIENCES,2023,"Chunguang Cui,Wen Zhou,Hao Yang,Xiaokang Wang,Yi Deng,Xiaofang Wang,Guirong Xu,Jingyu Wang"
,An energetics tale of the 2022 mega-heatwave over central-eastern China,npj Climate and Atmospheric Science,2023,"Tuantuan Zhang,Yi Deng,Junwen Chen,Song Yang,Yongjiu Dai"
10.5194/gmd-16-1445-2023,Porting the WAVEWATCH III (v6.07) wave action source terms to GPU,GEOSCIENTIFIC MODEL DEVELOPMENT,2023,"Olawale James Ikuyajolu,Luke Van Roekel,Steven R. Brus,Erin E. Thomas,Yi Deng,Sarat Sreepathi"
10.1029/2022JD037867,An Application of the Maximum Entropy Production Method in the WRF Noah Land Surface Model,JOURNAL OF GEOPHYSICAL RESEARCH-ATMOSPHERES,2023,"Chunhui Jia,Ping Zhao,Jingfeng Wang,Yi Deng,Na Li,Yingchun Wang,Shiguang Miao"
10.1038/s41612-022-00259-1,Amplifying subtropical hydrological transition over China in early summer tied to weakened mid-latitude synoptic disturbances,NPJ CLIMATE AND ATMOSPHERIC SCIENCE,2022,"Yana Li,Yi Deng,Ho-Nam Cheung,Wen Zhou,Song Yang,Henian Zhang"
10.1175/jamc-d-21-0221.1,A New Algorithm for Estimating Low Cloud Base Height in Southwest China,Journal of Applied Meteorology and Climatology,2022,"Rongjiang Wang,Renjun Zhou,Shuping Yang,Rui Li,Jiangping Pu,Kaiyu Liu,Yi Deng"
10.1016/j.atmosres.2022.106221,Multi-predictor ensembles improving seasonal prediction of summer rainfall over the Bohai Sea Rim based on statistical downscaling of BCC_CSM1.1 m,Atmospheric Research,2022,"Na Wang,Hong-Li Ren,Ying Liu,Yi Deng,Xiangxin Meng,Jie Wu,Fang Zhou"
10.1007/s00704-022-03958-0,Revisiting the linear instability view of the South Asian monsoon onset,Theoretical and Applied Climatology,2022,"Olawale James Ikuyajolu,Yi Deng"
10.1007/s00382-021-06048-5,Intraseasonal transition of Northern Hemisphere planetary waves and the underlying mechanism during the abrupt-change period of early summer,Climate Dynamics,2022,"Xie, Zuowei,Cholaw, Bueh,Deng, Yi,He, Bian,Lai, Sheng"
10.1088/1748-9326/ac79c1,Disentangling physical and dynamical drivers of the 2016/17 record-breaking warm winter in China,ENVIRONMENTAL RESEARCH LETTERS,2022,"Tuantuan Zhang,Yi Deng,Junwen Chen,Song Yang,Peng Gao,Henian Zhang"
10.1175/JHM-D-21-0068.1,Symbiotic Relationship between Mei-Yu Rainfall and the Morphology of Mei-Yu Front,JOURNAL OF HYDROMETEOROLOGY,2022,"Xiaokang Wang,Renjun Zhou,Yi Deng,Chunguang Cui,Yang Hu,Jingyu Wang,Hua Liu"
10.1007/s13351-022-1179-2,Dynamic Trigger and Moisture Source of Two Typical Meiyu Front Rainstorms Associated with Eastward-Moving Cloud Clusters from the Tibetan Plateau,Journal of Meteorological Research,2022,"Hao Yang,Yi Deng,Chunguang Cui,Xiaofang Wang,Xiquan Dong"
10.1007/s13143-021-00264-z,Understanding the Increasing Hot Extremes over the Northern Extratropics Using Community Atmosphere Model,Asia-Pacific Journal of Atmospheric Sciences,2022,"Zhao, Siyu,Zhang, Jiaying,Deng, Yi,Wang, Na"
10.1007/s00382-022-06159-7,Indirect effect of diabatic heating on Mei-yu frontogenesis,Climate Dynamics,2022,"Hu, Yang,Deng, Yi,Lin, Yanluan,Zhou, Zhimin,Cui, Chunguang,Li, Chao,Dong, Xiquan"
10.1175/JAS-D-20-0027.1,Charney Problem With A Generic Stratosphere,JOURNAL OF THE ATMOSPHERIC SCIENCES,2021,"Mankin Mak,Siyu Zhao,Yi Deng"
10.1007/s00382-020-05619-2,Dynamics Of The Spatiotemporal Morphology Of Mei-Yu Fronts: An Initial Survey,CLIMATE DYNAMICS,2021,"Yang Hu,Yi Deng,Yanluan Lin,Zhimin Zhou,Chunguang Cui,Xiquan Dong"
10.1007/s00382-021-05973-9,Impacts of late-spring North Eurasian soil moisture variation on summer rainfall anomalies in Northern East Asia,Climate Dynamics,2021,"Yinghan Sang,Hong-Li Ren,Yi Deng,Xiaofeng Xu,Xueli Shi,Shuo Zhao"
10.1007/s00376-020-0209-1,Integrative Monsoon Frontal Rainfall Experiment (Imfre-I): A Mid-Term Review,ADVANCES IN ATMOSPHERIC SCIENCES,2021,"Chunguang Cui,Xiquan Dong,Bin Wang,Baike Xi,Yi Deng,Yihui Ding"
10.1007/s00382-021-05687-y,Projected Changes In The Characteristics Of The East Asian Summer Monsoonal Front And Their Impacts On The Regional Precipitation,CLIMATE DYNAMICS,2021,"Yana Li,Ngar-Cheung Lau,Chi-Yung Tam,Ho-Nam Cheung,Yi Deng,Henian Zhang"
10.1007/s00382-021-05788-8,A Dynamical Pathway Bridging African Biomass Burning And Asian Summer Monsoon,CLIMATE DYNAMICS,2021,"Dianbin Cao,Tae-Won Park,Yongjia Song,Yuhang Wang,Zhenyu You,Yanluan Lin,Yi Deng"
10.1007/s00382-020-05602-x,Decomposition Of Projected Summer Rainfall Change Over East Asia Based On Timeslice Experiments,CLIMATE DYNAMICS,2021,"Yu Huang,Hong-Li Ren,Robin Chadwick,Yi Deng"
10.1029/2021JD035005,Structure and Large-Scale Organization of Extreme Cold Wave Events Over the Chinese Mainland During the Boreal Cold Season,JOURNAL OF GEOPHYSICAL RESEARCH-ATMOSPHERES,2021,"L. Zhang,Z. Xie,Y. Deng,W. Huang"
10.1175/JCLI-D-20-0226.1,How Were The Eastward-Moving Heavy Rainfall Events From The Tibetan Plateau To The Lower Reaches Of The Yangtze River Enhanced?,JOURNAL OF CLIMATE,2021,"Yang Zhao,Deliang Chen,Yi Deng,Seok-Woo Son,Xiang Wang,Di Di,Mengting Pan,Xiaodan Ma"
10.1175/JCLI-D-21-0049.1,Interannual Variability of Springtime Extreme Heat Events over the Southeastern Edge of the Tibetan Plateau: Role of a Spring-Type Circumglobal Teleconnection Pattern,JOURNAL OF CLIMATE,2021,"Tuantuan Zhang,Xingwen Jiang,Junwen Chen,Song Yang,Yi Deng,Wei Wei,Peng Hu,Peng Gao"
10.2139/ssrn.3996985,Multi-Predictor Ensembles Improving Summer Rainfall Prediction Over the Bohai Sea Rim Based on Statistical Downscaling of Bcc_Csm1.1m,Social Science Research Network,2021,"Na Wang,Hong-Li Ren,Ying Liu,Yi Deng,Xiangxin Meng,Jie Wu,Fang Zhou"
10.1016/j.jweia.2020.104415,Typhoons of western North Pacific basin under warming climate and implications for future wind hazard of East Asia,Journal of Wind Engineering and Industrial Aerodynamics,2021,"Yu Chen,Zhongdong Duan,Jian Yang,Yi Deng,Tiantian Wu,Jinping Ou"
10.1175/JCLI-D-18-0799.1,A Nonmodal Instability Perspective of the Declining Northern Mid-latitude Synoptic Variability in Boreal Summer,JOURNAL OF CLIMATE,2020,"Siyu Zhao,Yi Deng,Wenhong Li"
10.1007/s00382-019-05114-3,Decomposing East-Asian winter temperature and monsoonal circulation changes using timeslice experiments,Climate Dynamics,2020,"Hong-Li Ren,Yu Huang,Rob Chadwick,Yi Deng"
10.1175/JCLI-D-19-0174.1,Signals of Spring Thermal Contrast Related to the Interannual Variations in the Onset of the South China Sea Summer Monsoon,JOURNAL OF CLIMATE,2020,"Yana Li,Song Yang,Yi Deng,Bin Zheng"
10.1175/jhm-d-19-0209.1,A causal-inference model based on Random Forest to identify the effect of soil moisture on precipitation,Journal of Hydrometeorology,2020,"Lu Li,Wei Shangguan,Yi Deng,Jiafu Mao,JinJing Pan,Nan Wei,Hua Yuan,Shupeng Zhang,Yonggen Zhang,Yongjiu Dai"
10.3390/atmos11030262,The Long-Term Change of Latent Heat Flux over the Western Tibetan Plateau,ATMOSPHERE,2020,"Na Li,Ping Zhao,Jingfeng Wang,Yi Deng"
10.1175/JHM-D-19-0209.1,A Causal Inference Model Based On Random Forests To Identify The Effect Of Soil Moisture On Precipitation,JOURNAL OF HYDROMETEOROLOGY,2020,"Lu Li,Wei Shangguan,Yi Deng,Jiafu Mao,Jinjing Pan,Nan Wei,Hua Yuan,Shupeng Zhang,Yonggen Zhang,Yongjiu Dai"
10.1175/JAS-D-18-0163.1,A Causality-Based View of the Interaction between Synoptic- and Planetary-Scale Atmospheric Disturbances,JOURNAL OF THE ATMOSPHERIC SCIENCES,2020,"Savini M. Samarasinghe,Yi Deng,Imme Ebert-Uphoff"
10.1155/2020/8827071,Simulating Heavy Meiyu Rainfall: A Note On The Choice Of The Model Microphysics Scheme,ADVANCES IN METEOROLOGY,2020,"Zhimin Zhou,Yi Deng,Yang Hu,Zhaoping Kang"
10.1029/2019JD031952,Localization and Invigoration of Mei-yu Front Rainfall due to Aerosol-Cloud Interactions: A Preliminary Assessment Based on WRF Simulations and IMFRE 2018 Field Observations,JOURNAL OF GEOPHYSICAL RESEARCH-ATMOSPHERES,2020,"Lin Liu,Chunguang Cui,Yi Deng,Zhimin Zhou,Yang Hu,Bin Wang,Jing Ren,Zhaoxin Cai,Yongqing Bai,Junmei Yang,Xiquan Dong"
10.1002/joc.6595,Austral Summer Precipitation Biases Over Tropical South America In Five Cmip5 Earth System Models,INTERNATIONAL JOURNAL OF CLIMATOLOGY,2020,"Fernanda Cerqueira Vasconcellos,Yi Deng,Henian Zhang,Guilherme Martins"
10.1029/2019JD031955,Hydrometeor Budget of the Meiyu Frontal Rainstorms Associated with Two Different Atmospheric Circulation Patterns,JOURNAL OF GEOPHYSICAL RESEARCH-ATMOSPHERES,2020,"Chao Li,Yi Deng,Chunguang Cui,Xiaofang Wang,Xiquan Dong,Xingwen Jiang"
10.1007/s00382-020-05157-x,Nonmodal growth of atmospheric disturbances relevant to the East Asian pressure surge in boreal winter,Climate Dynamics,2020,"Siyu Zhao,Yi Deng"
10.1175/JHM-D-18-0240.1,Contrasting Pre-Mei-Yu and Mei-Yu Extreme Precipitation in the Yangtze River Valley: Influencing Systems and Precipitation Mechanisms,JOURNAL OF HYDROMETEOROLOGY,2019,"Xiaokang Wang,Xiquan Dong,Yi Deng,Chunguang Cui,Rong Wan,Wenjun Cui"
10.1007/s00382-018-4422-x,A survey of the atmospheric physical processes key to the onset of Arctic sea ice melt in spring,Climate Dynamics,2019,"Yiyi Huang,Xiquan Dong,Baike Xi,Yi Deng"
10.1007/s00382-018-4546-z,Multi-scale temporal-spatial variability of the East Asian summer monsoon frontal system: observation versus its representation in the GFDL HiRAM,Climate Dynamics,2019,"Yana Li,Yi Deng,Song Yang,Henian Zhang,Yi Ming,Zhaoyi Shen"
10.1007/s00382-018-4453-3,Statistical predictability of Niño indices for two types of ENSO,Climate Dynamics,2019,"Hong-Li Ren,Jinqing Zuo,Yi Deng"
10.1007/s00382-018-4345-6,Intraseasonal variation of the summer rainfall over the Southeastern United States,Climate Dynamics,2019,"Wei Wei,Wenhong Li,Yi Deng,Song Yang"
10.1007/s00382-018-4415-9,Correction to: Intraseasonal variation of the summer rainfall over the Southeastern United States,Climate Dynamics,2019,"Wei Wei,Wenhong Li,Yi Deng,Song Yang"
10.1007/s00382-018-4501-z,A statistical and dynamical characterization of large-scale circulation patterns associated with summer extreme precipitation over the middle reaches of Yangtze river,Climate Dynamics,2019,"Yang Hu,Yi Deng,Zhimin Zhou,Chunguang Cui,Xiquan Dong"
10.1029/2019gl082791,Thicker clouds and accelerated Arctic sea ice decline: The atmosphere‐sea ice interactions in spring,Geophysical Research Letters,2019,"Yiyi Huang,Xiquan Dong,David A. Bailey,Marika M. Holland,Baike Xi,Alice K. DuVivier,Jennifer E. Kay,Laura Landrum,Yi Deng"
10.1007/s00382-019-04681-9,Detection and attribution of upper-tropospheric warming over the tropical western Pacific,Climate Dynamics,2019,"Yana Li,Song Yang,Yi Deng,Xiaoming Hu,Ming Cai,Wen Zhou"
10.1007/s00382-019-04683-7,Planetary and synoptic-scale dynamic control of extreme cold wave patterns over the United States,Climate Dynamics,2019,"Zuowei Xie,Robert X. Black,Yi Deng"
10.1007/s00382-019-04708-1,Impacts of the North Atlantic subtropical high on interannual variation of summertime heat stress over the conterminous United States,Climate Dynamics,2019,"Wenhong Li,Tian Zou,Laifang Li,Yi Deng,Victor T. Sun,Qinghong Zhang,J. Bradley Layton,Soko Setoguchi"
10.1007/s00382-018-4232-1,Decadal evolution of the surface energy budget during the fast warming and global warming hiatus periods in the ERA-interim,Climate Dynamics,2019,"Xiaoming Hu,Sergio A. Sejas,Ming Cai,Patrick C. Taylor,Yi Deng,Song Yang"
10.1029/2018JD029959,Estimation of surface heat fluxes over the central Tibetan Plateau Using the maximum entropy production model,JOURNAL OF GEOPHYSICAL RESEARCH-ATMOSPHERES,2019,"Na Li,Ping Zhao,Jingfeng Wang,Yi Deng"
10.1007/s00382-019-04803-3,A synoptic assessment of the summer extreme rainfall over the middle reaches of Yangtze River in CMIP5 models,Climate Dynamics,2019,"Yang Hu,Yi Deng,Zhimin Zhou,Hongli Li,Chunguang Cui,Xiquan Dong"
10.1109/TPEL.2017.2747584,Optimized Control of the Modular Multilevel Converter Based on Space Vector Modulation,IEEE Transactions on Power Electronics,2018,"Yi Deng,Yebin Wang,Koon Hoo Teo,Maryam Saeedifard,Ronald G. Harley"
10.1007/s00382-017-4043-9,A process-level attribution of the annual cycle of surface temperature over the Maritime Continent,Climate Dynamics,2018,"Yana Li,Song Yang,Yi Deng,Xiaoming Hu,Ming Cai"
10.1175/jcli-d-18-0206.1,An Intraseasonal Mode of Atmospheric Variability Relevant to the United States Hydroclimate in Boreal Summer: Dynamic Origin and East Asia Connection,Journal of Climate,2018,"Siyu Zhao,Yi Deng,Robert X. Black"
https://doi.org/10.1007/s00382-017-3750-6,Dynamical and thermodynamical coupling between the North Atlantic subtropical high and the marine boundary layer clouds in boreal summer,Climate Dynamics,2018,"Wei Wei,Wenhong Li,Yi Deng,Song Yang,Jonathan H. Jiang,Lei Huang,W. Timothy Liu"
10.5194/acp-2017-997,A Preliminary Assessment of the Impacts of Multiple Temporal-scale Variations in Particulate Matter on its Source Apportionment,Atmospheric Chemistry and Physics,2018,"Xing Peng,Jian Gao,Guo-Liang Shi,Xurong Shi,Yanqi Huangfu,Jiayuan Liu,Yue-Chong Zhang,Yin-Chang Feng,Wei Wang,Ruoyu Ma,Cesunica E. Ivey,Yi Deng"
10.1175/JCLI-D-18-0206.1,An Intraseasonal Mode of Atmospheric Variability Relevant to the US Hydroclimate in Boreal Summer: Dynamic Origin and East Asia Connection,JOURNAL OF CLIMATE,2018,"Siyu Zhao,Yi Deng,Robert X. Black"
10.1007/s00382-017-3975-4,Multi-scale temporospatial variability of the East Asian Meiyu-Baiu fronts: characterization with a suite of new objective indices,Climate Dynamics,2018,"Yana Li,Yi Deng,Song Yang,Henian Zhang"
10.1007/s00382-017-3872-x,A process-based decomposition of decadal-scale surface temperature evolutions over East Asia,Climate Dynamics,2018,"Junwen Chen,Yi Deng,Wenshi Lin,Song Yang"
10.1007/s00382-018-4088-4,Response of eddy activities to localized diabatic heating in Held–Suarez simulations,Climate Dynamics,2018,"Yanluan Lin,Jishi Zhang,Xingrui Li,Yi Deng"
10.1175/JCLI-D-17-0401.1,Response of subtropical stationary waves and hydrological extremes to climate warming in boreal summer,JOURNAL OF CLIMATE,2018,"Jiacan Yuan,Wenhong Li,Robert E. Kopp,Yi Deng"
10.1002/2017MS001175,Hindcasting the Madden-Julian Oscillation With a New Parameterization of Surface Heat Fluxes.,JOURNAL OF ADVANCES IN MODELING EARTH SYSTEMS,2017,"Junwen Chen,Yi Deng,Jingfeng Wang,Wenshi Lin"
10.1038/s41598-017-04623-7,Inter-Model Warming Projection Spread: Inherited Traits From Control Climate Diversity,SCIENTIFIC REPORTS,2017,"Xiaoming Hu,Patrick C. Taylor,Ming Cai,Song Yang,Yi Deng,Sergio Sejas"
10.1175/JCLI-D-15-0366.1,Dynamical and Thermodynamical Impacts of High- and Low-Frequency Atmospheric Eddies on the Initial Melt of Arctic Sea Ice,JOURNAL OF CLIMATE,2017,"Bradley M. Hegyi,Yi Deng"
10.1002/2017JD027279,Observed and Simulated Spring and Summer Dryness in the United States: The Impact of the Pacific Sea Surface Temperature and Beyond,JOURNAL OF GEOPHYSICAL RESEARCH-ATMOSPHERES,2017,"Siyu Zhao,Yi Deng,Robert X. Black"
10.1175/JCLI-D-15-0910.1,A Dynamical and Statistical Characterization of U.S. Extreme Precipitation Events and Their Associated Large-Scale Meteorological Patterns,JOURNAL OF CLIMATE,2017,"Siyu Zhao,Yi Deng,Robert X. Black"
10.1016/j.cageo.2016.10.008,Causal discovery in the geosciencesUsing synthetic data to learn how to interpret results,Computers & Geosciences,2017,"Imme Ebert-Uphoff,Yi Deng"
10.1175/JAS-D-16-0171.1,Two Issues Concerning Surface Frontogenesis,JOURNAL OF THE ATMOSPHERIC SCIENCES,2017,"Mankin Mak,Yi Lu,Yi Deng"
10.1007/s00382-017-3564-6,The structure and large-scale organization of extreme cold waves over the conterminous United States,CLIMATE DYNAMICS,2017,"Zuowei Xie,Robert X. Black,Yi Deng"
10.1109/COMPEL.2017.8013388,Modelling And Evaluation Of Thermal Performance Of Rotor-Side Converters Of Dfig Wind Turbines,2017 IEEE 18TH WORKSHOP ON CONTROL AND MODELING FOR POWER ELECTRONICS (COMPEL),2017,"Jun Li,Yi Deng"
10.1175/JCLI-D-16-0869.1,A Process-Based Assessment of Decadal-Scale Surface Temperature Evolutions in the NCAR CCSM4’s 25-Year Hindcast Experiments,JOURNAL OF CLIMATE,2017,"Junwen Chen,Yi Deng,Wenshi Lin,Song Yang"
10.1175/JCLI-D-15-0742.1,Process-Based Decomposition of the Decadal Climate Difference between 2002–13 and 1984–95,JOURNAL OF CLIMATE,2017,"Xiaoming Hu,Yana Li,Song Yang,Yi Deng,Ming Cai"
10.1002/2017ms001175,Hindcasting the Madden-Julian Oscillation With a New Parameterization of Surface Heat Fluxes: MJO HINDCAST IN THE WRF-MEP MODEL,Journal of Advances in Modeling Earth Systems,2017,"Junwen Chen,Yi Deng,Jingfeng Wang,Wenshi Lin"
https://doi.org/10.1007/s00382-016-3395-x,Revisiting the global surface energy budgets with maximum-entropy-production model of surface heat fluxes,Climate Dynamics,2017,"Shih-Yu Huang,Yi Deng,Jingfeng Wang"
10.1002/2017jd026768,Daily-scale planetary wave patterns and the modulation of cold season weather in the northern extratropics: Daily-Scale Planetary Wave Patterns,Journal of Geophysical Research,2017,"Z. Xie,Robert X. Black,Yi Deng"
10.1175/JAS-D-16-0244.1,Reply to “Comments on ‘Dynamics of Upper-Level Frontogenesis in Baroclinic Waves’”,JOURNAL OF THE ATMOSPHERIC SCIENCES,2017,"Mankin Mak,Yi Lu,Yi Deng"
,Bringing Uncertainty into Focus: Control Climate Lens Clarifies the Inter-Model Spread in Global Warming Projections,Nature Climate Change,2017,"Xiaoming Hu,Patrick C. Taylor,Ming Cai,Song Yang,Yi Deng,Sergio A. Sejas"
10.1109/TPEL.2016.2573823,Improved Modulation Scheme for Loss Balancing of Three-Level Active NPC Converters,IEEE Transactions on Power Electronics,2017,"Yi Deng,Jun Li,Kee Ho Shin,Tero Viitanen,Maryam Saeedifard,Ronald G. Harley"
10.1109/ICDM.2017.109,High-Dimensional Dependency Structure Learning For Physical Processes,2017 17TH IEEE INTERNATIONAL CONFERENCE ON DATA MINING (ICDM),2017,"Jamal Golmohammadi,Imme Ebert-Uphoff,Sijie He,Yi Deng,Arindam Banerjee"
10.1016/j.atmosres.2016.11.010,Quantifying the relationship between extreme air pollution events and extreme weather events,Atmospheric Research,2017,"Henian Zhang,Yuhang Wang,Tae-Won Park,Yi Deng"
10.1175/JCLI-D-16-0321.1,Warm Season Dry Spells in the Central and Eastern United States: Diverging Skill in Climate Model Representation,JOURNAL OF CLIMATE,2016,"Siyu Zhao,Yi Deng,Robert X. Black"
10.1109/TPEL.2015.2429595,A Simplified Space Vector Modulation Scheme for Multilevel Converters,"Power Electronics, IEEE Transactions",2016,"Deng, Y.,Wang, Y.,Teo, K.,Harley, R.G."
10.1109/ECCE.2016.7855461,Staircase modulation of modular multilevel converters with minimal total harmonic distortion and maximal number of output voltage levels,IEEE Energy Conversion Congress and Exposition,2016,"Sufei Li,Yi Deng,Ronald G. Harley"
10.1175/bams-d-14-00287.1,Feeling the Pulse of the Stratosphere: An Emerging Opportunity for Predicting Continental-Scale Cold-Air Outbreaks 1 Month in Advance,Bulletin of the American Meteorological Society,2016,"Ming Cai,Yueyue Yu,Yi Deng,Huug M. van den Dool,Rongcai Ren,Suru Saha,Xingren Wu,Jin Huang"
10.1175/JAS-D-15-0250.1,Dynamics of Upper-Level Frontogenesis in Baroclinic Waves,JOURNAL OF THE ATMOSPHERIC SCIENCES,2016,"Mankin Mak,Yi Lu,Yi Deng"
10.1175/JCLI-D-16-0157.1,Impact of Environmental Aerosols on a Developing Extratropical Cyclone in the Superparameterized Community Atmosphere Model,JOURNAL OF CLIMATE,2016,"Yi Lu,Yi Deng"
10.1007/978-3-319-17220-0_11,Using Causal Discovery Algorithms to Learn About Our Planet’s Climate,,2015,"imme ebertuphoff,yi deng"
10.1007/s00382-015-2483-7,A new dynamical index for classification of cold surge types over East Asia,Climate Dynamics,2015,"taewon park,changhoi ho,jeehoon jeong,jinwoo heo,yi deng"
10.1109/TPEL.2014.2331687,Space-Vector Versus Nearest-Level Pulse Width Modulation for Multilevel Converters,"Power Electronics, IEEE Transactions  ",2015,"Yi Deng,Harley, R.G."
10.1007/s00704-014-1333-6,Skills of yearly prediction of the early-season rainfall over southern China by the NCEP climate forecast system,Theoretical and Applied Climatology,2015,"siyu zhao,song yang,yi deng,qiaoping li"
10.1175/JCLI-D-15-0251.1,Initial Transient Response of an Intensifying Baroclinic Wave to Increases in Cloud Droplet Number Concentration,JOURNAL OF CLIMATE,2015,"yi lu,yi deng"
10.1088/1748-9326/10/10/104009,Amplified subtropical stationary waves in boreal summer and their implications for regional water extremes,ENVIRONMENTAL RESEARCH LETTERS,2015,"Jiacan Yuan,Wenhong Li,Yi Deng"
10.1109/APEC.2015.7104560,An improved nearest-level modulation method for the modular multilevel converter,Applied Power Electronics Conference and Exposition,2015,"Yi Deng,Saeedifard, M.,Harley, R.G."
10.1175/JCLI-D-14-00598.1,Mass Footprints of the North Pacific Atmospheric Blocking Highs,JOURNAL OF CLIMATE,2015,"taewon park,yi deng,wenhong li,song yang,ming cai"
10.1109/APEC.2015.7104555,An optimized control strategy for the modular multilevel converter based on space vector modulation,Applied Power Electronics Conference and Exposition,2015,"Yi Deng,Saeedifard, M.,Harley, R.G."
10.1109/PSC.2015.7101695,Optimal allocation of power routers in a STATCOM-installed electric grid with high penetration of wind energy,Power Systems Conference,2015,"Yi Deng,Venayagamoorthy, G.K.,Harley, R.G."
10.1109/IJCNN.2015.7280720,Adaptive-critic-based control of a synchronous generator in a power system using biologically inspired artificial neural networks,International Joint Conference on Neural Networks,2015,"Jing Dai,Ganesh K. Venayagamoorthy,Ronald G. Harley,Yi Deng,Steve M. Potter"
10.1007/s00382-014-2371-6,Quantitative decomposition of radiative and non-radiative contributions to temperature anomalies related to siberian high variability,Climate Dynamics,2015,"taewon park,jeehoon jeong,yi deng,renjun zhou,ming cai"
10.1109/MCSE.2015.129,Identifying Physical Interactions from Climate Data: Challenges and Opportunities,Computing in Science & Engineering,2015,"Imme Ebert-Uphoff,Yi Deng"
10.1002/2014GL059275,Influence of climate variability on near‐surface ozone depletion events in the Arctic spring,GEOPHYSICAL RESEARCH LETTERS,2014,"jaho koo,yuhang wang,tianyu jiang,yi deng,samuel j oltmans,sverre solberg"
,Influence of climate variability on near-surface ozone depletion events in the Arctic spring: CLIMATE EFFECT TO THE ARCTIC OZONE,Geophysical Research Letters,2014,"yi deng,tianyu jiang,samuel j oltmans,sverre solberg,yuhang wang,jaho koo"
10.1002/2013JD021150,"A model of energy budgets over water, snow, and ice surfaces",JOURNAL OF GEOPHYSICAL RESEARCH-ATMOSPHERES,2014,"jingfeng wang,rafael l bras,v nieves,yi deng"
10.1088/1748-9326/9/12/124005,Feedback attribution of the land-sea warming contrast in a global warming simulation of the NCAR CCSM4,ENVIRONMENTAL RESEARCH LETTERS,2014,"sergio a sejas,oriene s albert,ming cai,yi deng"
10.1002/2013GL058646,Weakening of atmospheric information flow in a warming climate in the Community Climate System Model,GEOPHYSICAL RESEARCH LETTERS,2014,"yi deng,imme ebertuphoff"
10.1007/s00382-013-1817-6,A synoptic and dynamical characterization of wave-train and blocking cold surge over East Asia,Climate Dynamics,2014,"taewon park,changhoi ho,yi deng"
10.1109/IECON.2014.7049213,Space vector modulation method for modular multilevel converters,IECON,2014,"Yi Deng,Yebin Wang,Koon Hoo Teo,Harley, R.G."
10.1109/ICMLA.2014.96,Causal Discovery from Spatio-Temporal Data with Applications to Climate Science,Machine Learning and Applications,2014,"Imme Ebert-Uphoff,Yi Deng"
10.1002/2013JD021209,Intermediate frequency atmospheric disturbances: A dynamical bridge connecting western U.S. extreme precipitation with East Asian cold surges,JOURNAL OF GEOPHYSICAL RESEARCH-ATMOSPHERES,2014,"tianyu jiang,katherine j evans,yi deng,x dong"
10.1109/PSC.2014.6808126,Optimal utilization of STATCOM devices in a power system with high penetration of wind generation,Power Systems Conference,2014,"Yi Deng,Venayagamoorthy, G.K.,Harley, R.G."
10.1007/s00382-013-1920-8,Critical mechanisms for the formation of extreme arctic sea-ice extent in the summers of 2007 and 1996,Climate Dynamics,2014,"x dong,behnjamin zib,baike xi,ryan e stanfield,yi deng,xiangdong zhang,bing lin,charles n long"
10.1007/s00382-013-2029-9,A dissection of the surface temperature biases in the Community Earth System Model,Climate Dynamics,2014,"taewon park,yi deng,ming cai,jeehoon jeong,renjun zhou"
10.1175/JCLI-D-13-00289.1,Initial Transient Response of the Winter Polar Stratospheric Vortex to Idealized Equatorial Pacific Sea Surface Temperature Anomalies in the NCAR WACCM,JOURNAL OF CLIMATE,2014,"bradley m hegyi,yi deng,robert x black,renjun zhou"
10.1175/JCLI-D-11-00674.1,Reply to “Comments on ‘Changes to the North Atlantic Subtropical High and Its Role in the Intensification of Summer Rainfall Variability in the Southeastern United States’”,JOURNAL OF CLIMATE,2013,"wenhong li,laifang li,rong fu,yi deng,hui wang"
10.1002/2013GL058124,Intensification of the Southern Hemisphere summertime subtropical anticyclones in a warming climate,GEOPHYSICAL RESEARCH LETTERS,2013,"Wenhong Li,Laifang Li,Mingfang Ting,Yi Deng,Yochanan Kushnir,Yimin Liu,Yi Lu,Chunzai Wang,Pengfei Zhang"
