doi,标题,期刊,年份,作者
,Supervised deep learning with vision transformer predicts delirium using limited lead EEG,Scientific Reports,2023,"Malissa A. Mulkey,Huyunting Huang,Thomas Albanese,Sunghan Kim,Baijian Yang"
,spaCl: deciphering spatial cellular communications through adaptive graph model,BRIEFINGS IN BIOINFORMATICS,2023,"Ziyang Tang,Tonglin Zhang,Baijian Yang,Jing Su,Qianqian Song"
,"Husformer: A Multi-Modal Transformer for Multi-Modal Human State
  Recognition",,2023,"Ruiqi Wang,Wonse Jo,Dezhong Zhao,Weizheng Wang,Baijian Yang,Guohua Chen,Byung-Cheol Min"
,SiGra: single-cell spatial elucidation through an image-augmented graph transformer,Nature Communications,2023,"Ziyang Tang,Zuotian Li,Tieying Hou,Tonglin Zhang,Baijian Yang,Jing Su,Qianqian Song"
10.1109/JAS.2022.105632,A Triangulation-Based Visual Localization for Field Robots,IEEE/CAA Journal of Automatica Sinica,2022,"James Liang,Yuxing Wang,Yingjie Chen,Baijian Yang,Dongfang Liu"
10.1093/bib/bbac563,spaCI: deciphering spatial cellular communications through adaptive graph model.,Briefings in bioinformatics,2022,"Ziyang Tang,Tonglin Zhang,Baijian Yang,Jing Su,Qianqian Song"
10.1101/2022.08.18.504464,SiGra: Single-cell spatial elucidation through image-augmented graph transformer,,2022,"Ziyang Tang,Tonglin Zhang,Baijian Yang,Jing Su,Qianqian Song"
10.1142/S0129065722500447,Uncovering Brain Differences in Preschoolers and Young Adolescents with Autism Spectrum Disorder Using Deep Learning,INTERNATIONAL JOURNAL OF NEURAL SYSTEMS,2022,"Shijun Li,Ziyang Tang,Nanxin Jin,Qiansu Yang,Gang Liu,Tiefang Liu,Jianxing Hu,Sijun Liu,Ping Wang,Jingru Hao,Zhiqiang Zhang,Xiaojing Zhang,Jinfeng Li,Xin Wang,Zhenzhen Li,Yi Wang,Baijian Yang,Lin Ma"
10.1109/CSCloud-EdgeCom54986.2022.00012,SemiCon: A Semi-supervised Learning for Industrial Image Inspection,2022 IEEE 9th International Conference on Cyber Security and Cloud Computing (CSCloud)/2022 IEEE 8th International Conference on Edge Computing and Scalable Cloud (EdgeCom),2022,"Weitao Tang,Tonglin Zhang,Baijian Yang"
10.1109/FIE56618.2022.9962643,Cybersecurity Education in the Age of Artificial Intelligence: A Novel Proactive and Collaborative Learning Paradigm.,FIE,2022,"Jin Wei-Kocsis,Moein Sabounchi,Baijian Yang,Tonglin Zhang"
,The Alcoholic Hepatitis Network Research Data Commons (ARDaC): Design and Development.,AMIA,2022,"Jing Su,Nanxin Jin,Zuotan Li,Carla Kettler,Bruce Barton,Greg Puetz,Chi Mai Nguyen,Donna McGrath,Yingjie Chen,Baijian Yang,Vijay Shah,Svetlana Radaeva,Samer Gawrieh,Wanzhu Tu"
,Managing Controlled Unclassified Information in Research Institutions,,2022,"Baijian Yang,Carolyn Ellis,Preston Smith,Huyunting Huang"
,ADNet: Identify biomarkers of Alzheimer Disease with MRI and EMR data using Deep Neural Networks.,AMIA,2021,"Ziyang Tang,Qianqian Song,Jing Su,Baijian Yang"
,Densernet: Weakly Supervised Visual Localization Using Multi-Scale Feature Aggregation,"THIRTY-FIFTH AAAI CONFERENCE ON ARTIFICIAL INTELLIGENCE, THIRTY-THIRD CONFERENCE ON INNOVATIVE APPLICATIONS OF ARTIFICIAL INTELLIGENCE AND THE ELEVENTH SYMPOSIUM ON EDUCATIONAL ADVANCES IN ARTIFICIAL INTELLIGENCE",2021,"Dongfang Liu,Yiming Cui,Liqi Yan,Christos Mousas,Baijian Yang,Yingjie Chen"
,Online Multiple Learning With Working Sufficient Statistics For Generalized Linear Models In Big Data,STATISTICS AND ITS INTERFACE,2021,"Tonglin Zhang,Baijian Yang"
10.1007/s00138-021-01226-1,Anomaly Detection Of Core Failures In Die Casting X-Ray Inspection Images Using A Convolutional Autoencoder,MACHINE VISION AND APPLICATIONS,2021,"Weitao Tang,Corey M. Vian,Ziyang Tang,Baijian Yang"
,DenserNet: Weakly Supervised Visual Localization Using Multi-scale Feature Aggregation.,CoRR,2020,"Dongfang Liu,Yiming Cui,Liqi Yan,Christos Mousas,Baijian Yang,Yingjie Victor Chen"
10.1109/FIE44824.2020.9273931,CHEESE: Cyber Human Ecosystem of Engaged Security Education,2020 IEEE Frontiers in Education Conference (FIE),2020,"Rajesh Kalyanam,Baijian Yang,Craig Willis,Mike Lambert,Christine Kirkpatrick"
10.3390/ai1020010,Deep Learning Based Wildfire Event Object Detection from 4K Aerial Images Acquired by UAS,Artificial Intelligence,2020,"Ziyang Tang,Xiang Liu,Hanlin Chen,Joseph Hupy,Baijian Yang"
10.1109/GLOBECOM42002.2020.9322471,Regression PCA for Moving Objects Separation.,GLOBECOM,2020,"Huyunting Huang,Xiang Liu,Tonglin Zhang,Baijian Yang"
10.1109/ICPR48806.2021.9411961,Visual Localization For Autonomous Driving: Mapping The Accurate Location In The City Maze,2020 25TH INTERNATIONAL CONFERENCE ON PATTERN RECOGNITION (ICPR),2020,"Dongfang Liu,Yiming Cui,Xiaolei Guo,Wei Ding,Baijian Yang,Yingjie Chen"
10.1109/BigData47090.2019.9006448,Sparse Block Regression (SBR) for Big Data with Categorical Variables,2019 IEEE International Conference on Big Data (Big Data),2019,"Xiang Liu,Huyunting Huang,Ziyang Tang,Tonglin Zhang,Baijian Yang"
10.1109/BigDataSecurity-HPSC-IDS.2019.00012,Security Vulnerabilities in Consumer IoT Applications,"2019 IEEE 5th Intl Conference on Big Data Security on Cloud (BigDataSecurity), IEEE Intl Conference on High Performance and Smart Computing, (HPSC) and IEEE Intl Conference on Intelligent Data and Security (IDS)",2019,"Arjun Shakdhe,Suyash Agrawal,Baijian Yang"
10.1145/3349266.3351393,CHEESE - Cyber Human Ecosystem of Engaged Security Education.,SIGITE,2019,"Baijian Yang,Rajesh Kalyanam,Craig Willis,Mike Lambert,Christine Kirkpatrick"
10.1109/BigDataSecurity-HPSC-IDS.2019.00022,Predicting Network Attacks with CNN by Constructing Images from NetFlow Data,"2019 IEEE 5th Intl Conference on Big Data Security on Cloud (BigDataSecurity), IEEE Intl Conference on High Performance and Smart Computing, (HPSC) and IEEE Intl Conference on Intelligent Data and Security (IDS)",2019,"Xiang Liu,Ziyang Tang,Baijian Yang"
10.1109/ICMLA.2019.00109,Multiple Learning for Regression in Big Data.,arXiv: Learning,2019,"Xiang Liu,Ziyang Tang,Huyunting Huang,Tonglin Zhang,Baijian Yang"
10.1109/SMC.2019.8913967,Computer Vision-Based Algae Removal Planner For Multi-Robot Teams,"2019 IEEE INTERNATIONAL CONFERENCE ON SYSTEMS, MAN AND CYBERNETICS (SMC)",2019,"Manoj Penmetcha,Shaocheng Luo,Arabinda Samantaray,J. Eric Dietz,Baijian Yang,Byung-Cheol Min"
10.1145/3349266.3351412,The Role of Multiple Representations and Representational Fluency in Cryptography Education.,SIGITE,2019,"Ziyang Tang,Xiang Liu,Yingjie Chen,Baijian Yang"
10.4310/sii.2018.v11.n2.a7,Dimension reduction for big data,STATISTICS AND ITS INTERFACE,2018,"Tonglin Zhang,Baijian Yang"
10.1145/3241815.3241853,Blockchain-Based Whitelisting for Consumer IoT Devices and Home Networks.,SIGITE,2018,"Diego M. Mendez Mena,Baijian Yang"
10.17781/p002380,The process of recovering image and web page artifacts from the GPU,International Journal of Cyber-Security and Digital Forensics,2018,"Yazeed Albabtain,Baijian Yang"
10.1109/BigData.2018.8622274,A Study of Exact Ridge Regression for Big Data,2018 IEEE INTERNATIONAL CONFERENCE ON BIG DATA (BIG DATA),2018,"Wanchih Chiang,Xiang Liu,Tonglin Zhang,Baijian Yang"
10.1109/VAST.2018.8802513,Phoenixmap: Spatio-Temporal Distribution Analysis With Deep Learning Classifications,2018 IEEE Conference on Visual Analytics Science and Technology (VAST),2018,"Junhan Zhao,Xiang Liu,Ryan Guan,Josephine Zhang,Baijian Yang,Zhenyu Cheryl Qian,Yingjie Victor Chen"
10.1109/BigData.2018.8621914,File Toolkit for Selective Analysis & Reconstruction (FileTSAR) for Large-Scale Networks,2018 IEEE INTERNATIONAL CONFERENCE ON BIG DATA (BIG DATA),2018,"Raymond A. Hansen,Kathryn Seigfried-Spellar,Seunghee Lee,Siddarth Chowdhury,Niveah Abraham,John Springer,Baijian Yang,Marcus Rogers"
10.1145/3241815.3241838,"RFID Security, Verification, and Blockchain: Vulnerabilities within the Supply Chain for Food Security.",SIGITE,2018,"Michael Hilt,Daniel Shao,Baijian Yang"
10.1109/TrustCom/BigDataSE.2018.00248,The Process Of Reverse Engineering Gpu Malware And Provide Protection To Gpus,"2018 17TH IEEE INTERNATIONAL CONFERENCE ON TRUST, SECURITY AND PRIVACY IN COMPUTING AND COMMUNICATIONS (IEEE TRUSTCOM) / 12TH IEEE INTERNATIONAL CONFERENCE ON BIG DATA SCIENCE AND ENGINEERING (IEEE BIGDATASE)",2018,"Yazeed Albabtain,Baijian Yang"
10.1080/19393555.2018.1458258,Internet Of Things: Survey On Security,INFORMATION SECURITY JOURNAL,2018,"Diego M. Mendez,Ioannis Papapanagiotou,Baijian Yang"
10.1109/BigData.2018.8622392,Streaming Algorithm for Big Data Logistic Regression,2018 IEEE INTERNATIONAL CONFERENCE ON BIG DATA (BIG DATA),2018,"Baijian Yang,Mengyao Wang,Zhenzhi Xu,Tonglin Zhang"
10.4236/jcc.2018.65010,A Comparative Study of Machine Learning Algorithms and Their Ensembles for Botnet Detection,Journal of Computational Chemistry,2018,"Songhui Ryu,Baijian Yang"
,Try-CybSI: An Extensible Cybersecurity Learning and Demonstration Platform.,SIGITE,2017,"Rajesh Kalyanam,Baijian Yang"
10.1007/s00180-017-0731-5,An exact approach to ridge regression for big data,Computational Statistics,2017,"Tonglin Zhang,Baijian Yang"
,A countermeasure against relay attack in NFC payment.,ICC,2017,"Peng Li,Huayi Fang,Xiang Liu,Baijian Yang"
10.1504/ijsn.2017.10009154,NetFlowMatrix: a visual approach for analysing large NetFlow data.,IJSN,2017,"Yingjie Chen,Baijian Yang,Weijie Wang"
10.1080/00401706.2016.1156025,Box-Cox Transformation in Big Data.,TECHNOMETRICS,2017,"Tonglin Zhang,Baijian Yang"
10.1109/BigData.2017.8258264,Finding The Best Box-Cox Transformation From Massive Datasets On Spark,2017 IEEE INTERNATIONAL CONFERENCE ON BIG DATA (BIG DATA),2017,"Huayi Fang,Baijian Yang,Tonglin Zhang"
10.1109/CSCloud.2017.53,Finding the Best Box-Cox Transformation in Big Data with Meta-Model Learning: A Case Study on QCT Developer Cloud,2017 IEEE 4th International Conference on Cyber Security and Cloud Computing (CSCloud),2017,"Yuxiang Gao,Tongling Zhang,Baijian Yang"
10.1109/CCNC.2017.7983086,Vulnerabilities in hub architecture IoT devices,2017 14th IEEE Annual Consumer Communications & Networking Conference (CCNC),2017,"Bogdan Alexandra Visan,Jiyoon Lee,Baijian Yang,Anthony H. Smith,Eric T. Matson"
10.1109/BigDataSecurity-HPSC-IDS.2016.71,A Scalable Meta-Model for Big Data Security Analyses,"2016 IEEE 2nd International Conference on Big Data Security on Cloud (BigDataSecurity), IEEE International Conference on High Performance and Smart Computing (HPSC), and IEEE International Conference on Intelligent Data and Security (IDS)",2016,"Baijian Yang,Tonglin Zhang"
10.1109/CLOUD.2016.113,A Black-Box Self-Learning Scheduler For Cloud Block Storage Systems,PROCEEDINGS OF 2016 IEEE 9TH INTERNATIONAL CONFERENCE ON CLOUD COMPUTING (CLOUD),2016,"Babak Ravandi,Ioannis Papapanagiotou,Baijian Yang"
10.1007/978-3-319-25512-5_5,Forensically Sound Retrieval and Recovery of Images from GPU Memory.,Lecture Notes of the Institute for Computer Sciences Social Informatics and Telecommunications Engineering,2015,"Yulong Zhang,Baijian Yang,Marcus Rogers,Raymond A. Hansen"
,Windows Phone 7 Programming for Android and iOS Developers,Windows Phone 7 Programming for Android and iOS Developers,2014,"Zhinan Zhou,Robert Zhu,Pei Zheng,Baijian Yang"
,Securing Virtualized Datacenters.,CoRR,2014,"Timur Mirzoev,Baijian Yang"
10.1016/j.comnet.2014.08.010,Trust-based incentive mechanism to motivate cooperation in hybrid P2P networks.,Computer Networks,2014,"Chunqi Tian,Baijian Yang,Jidong Zhong,Xiaojian Liu"
https://doi.org/10.1007/s12083-012-0153-7,A D-S evidence theory based fuzzy trust model in file-sharing P2P networks.,Peer-to-Peer Networking and Applications,2014,"Chunqi Tian,Baijian Yang"
null,Cable-Based Moving Reachability with Mobile Sensors.,AD HOC & SENSOR WIRELESS NETWORKS,2012,"Xiaoping Wang,Shanshan Li,Mo Li,Baijian Yang"
10.1016/j.future.2011.03.006,"R2 Trust, a reputation and risk based trust management framework for large-scale, fully decentralized overlay networks.",Future Generation Comp. Syst.,2011,"Chunqi Tian,Baijian Yang"
10.1109/WCNC.2009.4917789,LORP: a load-balancing based optimal routing protocol for sensor networks with bottlenecks,WCNC,2009,"Lijie Xu,Guihai Chen,Xinchun Yin,Panlong Yang,Baijian Yang"
,Cog Gap: Cognitive And Opportunistic Gateway Access For Wireless Mesh Networks,2009 IEEE 6TH INTERNATIONAL CONFERENCE ON MOBILE ADHOC AND SENSOR SYSTEMS (MASS 2009),2009,"Panlong Yang,Guihai Chen,Baijian Yang,Deke Guo,Yunhao Liu"
10.1109/ICPADS.2009.111,tk-coverage: Time-Based K-Coverage for Energy Efficient Monitoring,ICPADS,2009,"Zheng Yang,Bin Xu,Saier Ye,Baijian Yang"
10.1016/j.comnet.2009.03.012,On the reliability of large-scale distributed systems – A topological view,Computer Networks,2009,"Yuan He,Hao Ren,Yunhao Liu,Baijian Yang"
,PAS: Prediction-based Adaptive Sleeping for Diffusion Stimulus Monitoring Sensor Networks,AD HOC & SENSOR WIRELESS NETWORKS,2008,"Zheng Yang,Bin Xu,Baijian Yang,Jingyao Dai,Tao Gu"
,Design a Building Intelligence Management System with SOA and RFID Technology,Software Engineering Research and Practice,2007,"Jingyao Dai,Baijian Yang,Chifai Wong"
,Professional Microsoft Smartphone Programming,Professional Microsoft Smartphone Programming,2007,"Baijian Yang,Pei Zheng,Lionel M. Ni"
,A Survey on Topology issues in Wireless Sensor Network.,ICWN,2006,"Mo Li,Baijian Yang"
10.1109/ICCCAS.2006.284966,Achieving Anonymous Communication in Ad Hoc Networks,"Communications, Circuits and Systems Proceedings, 2006 International Conference",2006,"Dapeng Cheng,Jinsong Han,Mo Li,Baijian Yang"
,Server-Features Performance Evaluation Of Node In P2p Networks,"WMSCI 2006: 10TH WORLD MULTI-CONFERENCE ON SYSTEMICS, CYBERNETICS AND INFORMATICS, VOL III, PROCEEDINGS",2006,"Alexander Muravsky,Baijian Yang"
,Building a Secure and Reliable Network via Multi-homed VPN,,2006,"Baijian Yang,Tianguang Gao"
10.1109/ICCCN.2006.286307,A Framework to Provide Trust and Incentive in CROWN Grid for Dynamic Resource Management.,IEEE INTERNATIONAL CONFERENCE ON COMPUTER COMMUNICATIONS AND NETWORKS,2006,"Yu Zhang,Jinpeng Huai,Yunhao Liu,Li Lin,Baijian Yang"
10.1007/978-3-540-30141-7_23,Efficient Gnutella-like P2P Overlay Construction,LECTURE NOTES IN COMPUTER SCIENCE,2004,"Yunhao Liu,Li Xiao,Lionel M. Ni,Baijian Yang"
,Diffserv-aware multicasting,J. High Speed Networks,2004,"Baijian Yang,Prasant Mohapatra"
10.1016/S0140-3664(03)00212-3,Multicasting in MPLS domains,Computer Communications,2004,"Baijian Yang,Prasant Mohapatra"
,A Tree Building Technique for Overlay Multicasting in DiffServ Domains,"IC'03: PROCEEDINGS OF THE INTERNATIONAL CONFERENCE ON INTERNET COMPUTING, VOLS 1 AND 2",2003,"Baijian Yang,Abdol-hossein Esfahanian,Lionel M. Ni,Prasant Mohapatra"
,Supporting multicast in scalable qos frameworks,Supporting multicast in scalable qos frameworks,2002,"Prasant Mohapatra,Abdol-Hossein Esfahanian,Baijian Yang"
10.1109/ICON.2002.1033287,Edge router multicasting with MPLS traffic engineering,ICON,2002,"Baijian Yang,Prasant Mohapatra,Ingress LSR,IP L,IP"
10.1109/GLOCOM.2002.1188996,Multicasting in differentiated service domains,GLOBECOM,2002,"Baijian Yang,Prasant Mohapatra"
